,Listing,Actions,Avg Sold Price,Avg Shipping,Total Sold,Item_Sale,Bids,Date Last Sold
12,", preview full size image4 INCH Wooden Furniture Leg IKEA HORNSUND Part Solid Wood Foot4 INCH Wooden Furniture Leg IKEA HORNSUND Part Solid Wood Foot",EditSell SimilarExclude listing,$10.00Fixed price,$10.150% Free shipping,1,$10.00,–,"Jul 31, 2022"
13,", preview full size imageBag Full of IKEA Parts 144574 144575 Replacement PartsBag Full of IKEA Parts 144574 144575 Replacement Parts",EditExclude listing,$15.00Fixed price,$5.000% Free shipping,1,$15.00,–,"Jul 31, 2022"
14,", preview full size image1 IKEA Clothes Rail / Tube Bracket Support Plastic Gray Part # 1071281 IKEA Clothes Rail / Tube Bracket Support Plastic Gray Part # 107128",EditExclude listing,$7.99Fixed price,$4.650% Free shipping,1,$7.99,–,"Jul 30, 2022"
15,", preview full size imageIKEA Part # 110912 (2 pack) Cross Dowel Barrel Nut Dual End Sleeves HardwareIKEA Part # 110912 (2 pack) Cross Dowel Barrel Nut Dual End Sleeves Hardware",EditExclude listing,$18.99Fixed price,$0.00100% Free shipping,1,$18.99,–,"Jul 30, 2022"
16,", preview full size imageNew IKEA BRIMNES White Handle w/2 Screws Furniture Part # 130508 #10050606New IKEA BRIMNES White Handle w/2 Screws Furniture Part # 130508 #10050606",EditExclude listing,$10.75Fixed price,$0.00100% Free shipping,1,$10.75,–,"Jul 29, 2022"
17,", preview full size image24 Original Ikea Besta Shelf Pins Part #113301 Never Used. FREE SHIP to US24 Original Ikea Besta Shelf Pins Part #113301 Never Used. FREE SHIP to US",EditExclude listing,$15.00Fixed price,$0.00100% Free shipping,1,$15.00,–,"Jul 29, 2022"
18,", preview full size imageBilly Bookshelf Pins (Replacement for IKEA Part #131372) (Pack of 8)Billy Bookshelf Pins (Replacement for IKEA Part #131372) (Pack of 8)",EditExclude listing,$12.91Fixed price,$0.00100% Free shipping,3,$38.72,–,"Jul 28, 2022"
19,", preview full size imageIKEA VIDGA Corner Rail L Shaped White Plastic Replacement Part Piece HardwareIKEA VIDGA Corner Rail L Shaped White Plastic Replacement Part Piece Hardware",EditExclude listing,$8.96Fixed price,$11.650% Free shipping,9,$80.67,–,"Jul 28, 2022"
20,", preview full size imageIKEA New Key Hole Bracket Replacement Part #103693 for Sektion or PAX CabinetsIKEA New Key Hole Bracket Replacement Part #103693 for Sektion or PAX Cabinets",EditExclude listing,$1.95Fixed price,$4.700% Free shipping,1,$1.95,–,"Jul 28, 2022"
21,", preview full size imageIKEA BILLY Bookcase Support Pin - Part # 131372 ( 4 Pack)IKEA BILLY Bookcase Support Pin - Part # 131372 ( 4 Pack)",EditExclude listing,$6.75Fixed price,$0.00100% Free shipping,11,$74.23,–,"Jul 28, 2022"
22,", preview full size imageHUGE Lot of IKEA Pax replacement parts - Dowels, Cam screws, cam lock nuts, feetHUGE Lot of IKEA Pax replacement parts - Dowels, Cam screws, cam lock nuts, feet",EditExclude listing,$40.00Fixed price,$0.00100% Free shipping,1,$40.00,–,"Jul 27, 2022"
23,", preview full size image4 IKEA Part # 110912 Cross Dowel Barrel Nut dual end sleeves 4 IKEA Part # 110912 Cross Dowel Barrel Nut dual end sleeves ",EditSell SimilarExclude listing,$39.99Fixed price,$0.00100% Free shipping,3,$119.97,–,"Jul 27, 2022"
24,", preview full size imageIkea 2x Cross dowel nut sleeve, Part # 100505 FREE FAST SHIPPINGIkea 2x Cross dowel nut sleeve, Part # 100505 FREE FAST SHIPPING",EditExclude listing,$5.99Fixed price,$0.00100% Free shipping,1,$5.99,–,"Jul 27, 2022"
25,", preview full size image4 Ikea 6"" Birch Wood Legs for Karlstad Sofa  + 4 Screws + 4 Pegs  Part #1171424 Ikea 6"" Birch Wood Legs for Karlstad Sofa  + 4 Screws + 4 Pegs  Part #117142",EditExclude listing,$24.99Fixed price,$9.650% Free shipping,1,$24.99,–,"Jul 26, 2022"
26,", preview full size image4 IKEA Countersunk Metric Pins Part # 100106 - 55 mm. total length4 IKEA Countersunk Metric Pins Part # 100106 - 55 mm. total length",EditSell SimilarExclude listing,$9.45Fixed price,$4.170% Free shipping,4,$37.80,–,"Jul 26, 2022"
27,", preview full size imageIkea 4x Screws, Part # 108150 NEW Original FREE FAST SHIPPINGIkea 4x Screws, Part # 108150 NEW Original FREE FAST SHIPPING",EditSell SimilarExclude listing,$8.04Fixed price,$0.00100% Free shipping,4,$32.16,–,"Jul 25, 2022"
28,", preview full size image3x Ikea Nut Metric Sleeves C M6 25mm length x 10mm Width Hex5 Steel Part# 1069853x Ikea Nut Metric Sleeves C M6 25mm length x 10mm Width Hex5 Steel Part# 106985",EditExclude listing,$7.99Fixed price,$5.500% Free shipping,2,$15.98,–,"Jul 25, 2022"
29,", preview full size imageSet Of 4 Ikea BESTA Adjustable Feet Foot Leg Leveler 114947 115998  Screw PartSet Of 4 Ikea BESTA Adjustable Feet Foot Leg Leveler 114947 115998  Screw Part",EditExclude listing,$8.00Fixed price,$5.150% Free shipping,1,$8.00,–,"Jul 24, 2022"
30,", preview full size image4 x Ikea BESTA Adjustable Feet Foot Leg Leveler 114947 115998 Gray Screw Part4 x Ikea BESTA Adjustable Feet Foot Leg Leveler 114947 115998 Gray Screw Part",EditSell SimilarExclude listing,$8.99Fixed price,$4.990% Free shipping,2,$17.98,–,"Jul 24, 2022"
31,", preview full size imageIKEA 1 PAIR OF CONCEALED SLIDES 9 1/2"", 1 LEFT & 1 RIGHT,  PART # 118250IKEA 1 PAIR OF CONCEALED SLIDES 9 1/2"", 1 LEFT & 1 RIGHT,  PART # 118250",EditExclude listing,$19.99Fixed price,$9.900% Free shipping,1,$19.99,–,"Jul 24, 2022"
32,", preview full size imageSpare Hardware Parts Billy Bookshelf Pins (Replacement for IKEA Part #131372) (PSpare Hardware Parts Billy Bookshelf Pins (Replacement for IKEA Part #131372) (P",EditExclude listing,$12.12Fixed price,$0.00100% Free shipping,3,$36.36,–,"Jul 24, 2022"
33,", preview full size imageIkea Bed frame mounting plate, Part # 116791 (2 Pack) Same Day Priority ShippingIkea Bed frame mounting plate, Part # 116791 (2 Pack) Same Day Priority Shipping",EditExclude listing,$9.99Fixed price,$11.730% Free shipping,1,$9.99,–,"Jul 24, 2022"
34,", preview full size image4x Ikea Klippan Sofa Legs 4  1/2"" Tall Steel, Silver, Part # 3112564x Ikea Klippan Sofa Legs 4  1/2"" Tall Steel, Silver, Part # 311256",EditExclude listing,$24.99Fixed price,$9.650% Free shipping,1,$24.99,–,"Jul 24, 2022"
35,", preview full size imageIKEA ADILS 22724 Table Leg Connector Part No. 1441IKEA ADILS 22724 Table Leg Connector Part No. 1441",EditExclude listing,$4.99Auction,$5.400% Free shipping,1,$4.99,1,"Jul 23, 2022"
36,", preview full size image1 White Ikea Galant Desk Hook for Purse Headphone Part 158450 / 158451 / 1233351 White Ikea Galant Desk Hook for Purse Headphone Part 158450 / 158451 / 123335",EditExclude listing,$9.45Fixed price,$3.750% Free shipping,2,$18.90,–,"Jul 23, 2022"
37,", preview full size imageIKEA Screw Part # 153312 153307 (2 each) For SKADIS Pegboard Gray ReplacementIKEA Screw Part # 153312 153307 (2 each) For SKADIS Pegboard Gray Replacement",EditExclude listing,$9.99Fixed price,$0.00100% Free shipping,1,$9.99,–,"Jul 23, 2022"
38,", preview full size imageIKEA Set of Glass Door Pivot Hinge Part # 101649 # 101650 Hardware ReplacementIKEA Set of Glass Door Pivot Hinge Part # 101649 # 101650 Hardware Replacement",EditExclude listing,$18.99Fixed price,$0.00100% Free shipping,2,$37.98,–,"Jul 23, 2022"
39,", preview full size image20 IKEA EURO COUNTERSUNK SCREW FX  9mm STEEL FOR DRAWERS /  RAILS PART # 10036520 IKEA EURO COUNTERSUNK SCREW FX  9mm STEEL FOR DRAWERS /  RAILS PART # 100365",EditExclude listing,$4.99Fixed price,$5.050% Free shipping,11,$54.89,–,"Jul 22, 2022"
40,", preview full size imageIKEA 4 Legs for Ektorp Sofa 6 3/4” Tall Plastic Black Part # 121303 w Felt PadsIKEA 4 Legs for Ektorp Sofa 6 3/4” Tall Plastic Black Part # 121303 w Felt Pads",EditExclude listing,$24.00Fixed price,$10.220% Free shipping,1,$24.00,–,"Jul 21, 2022"
41,", preview full size image4 IKEA  Cross Dowel Nut Sleeves  Part # 1089034 IKEA  Cross Dowel Nut Sleeves  Part # 108903",EditSell SimilarExclude listing,$16.99Fixed price,$0.00100% Free shipping,29,$492.71,–,"Jul 20, 2022"
42,", preview full size imageIkea Flat top metric screws, Part # 120209 (2 pack) - NEWIkea Flat top metric screws, Part # 120209 (2 pack) - NEW",EditExclude listing,$3.50Fixed price,$6.450% Free shipping,1,$3.50,–,"Jul 20, 2022"
43,", preview full size image2 x IKEA Bolt Screw Hardware Replacement Part # 1311872 x IKEA Bolt Screw Hardware Replacement Part # 131187",EditExclude listing,$6.85Fixed price,$5.980% Free shipping,5,$34.25,–,"Jul 19, 2022"
44,", preview full size image1x Ikea Sofa Leg for Knislinge Sofa Plastic, Brown Part # 1225511x Ikea Sofa Leg for Knislinge Sofa Plastic, Brown Part # 122551",EditSell SimilarExclude listing,$7.99Fixed price,$5.400% Free shipping,1,$7.99,–,"Jul 19, 2022"
45,", preview full size imageIkea part 123756 Flat top metric screw  (4 pack) Same Day shipping from The USAIkea part 123756 Flat top metric screw  (4 pack) Same Day shipping from The USA",EditExclude listing,$12.77Fixed price,$0.00100% Free shipping,1,$12.77,–,"Jul 19, 2022"
46,", preview full size image4 pair of IKEA Mirror Holders Hardware Part # 105473 / 105474 -Fits Krabb mirror4 pair of IKEA Mirror Holders Hardware Part # 105473 / 105474 -Fits Krabb mirror",EditExclude listing,$5.35Fixed price,$7.950% Free shipping,3,$16.05,–,"Jul 17, 2022"
47,", preview full size image6x IKEA  Shelf Pins Pegs Supports Part # 1142586x IKEA  Shelf Pins Pegs Supports Part # 114258",EditExclude listing,$9.99Fixed price,$4.950% Free shipping,4,$39.96,–,"Jul 17, 2022"
48,", preview full size image3 IKEA Metric Screws Bed Pins Part 106569 / 105236 / 106918 / 130532 + Allen Key3 IKEA Metric Screws Bed Pins Part 106569 / 105236 / 106918 / 130532 + Allen Key",EditExclude listing,$4.45Fixed price,$3.630% Free shipping,2,$8.90,–,"Jul 17, 2022"
49,", preview full size imagePack of 20 IKEA Wood Dowels Part # 101345Pack of 20 IKEA Wood Dowels Part # 101345",EditExclude listing,$6.15Fixed price,$3.000% Free shipping,5,$30.75,–,"Jul 17, 2022"
0,", preview full size imageIkea Part # 100646  (4 Pack) Nut sleeve assembly  NEW Original Fast Shipping USAIkea Part # 100646  (4 Pack) Nut sleeve assembly  NEW Original Fast Shipping USA",EditExclude listing,$9.77Fixed price,$0.00100% Free shipping,3,$29.31,–,"Jul 16, 2022"
1,", preview full size image4 IKEA Screws Part # 1125484 IKEA Screws Part # 112548",EditSell SimilarExclude listing,$9.99Fixed price,$0.00100% Free shipping,3,$29.97,–,"Jul 16, 2022"
2,", preview full size image1 BLACK IKEA Metric Pin Screw Bolt Part # 139210 / 126903  1 BLACK IKEA Metric Pin Screw Bolt Part # 139210 / 126903  ",EditExclude listing,$4.95Fixed price,$3.750% Free shipping,1,$4.95,–,"Jul 16, 2022"
3,", preview full size image2 Ikea BLACK FINISH Part 112113 Metric Head Pins Screws Fasteners Bolts 2 Ikea BLACK FINISH Part 112113 Metric Head Pins Screws Fasteners Bolts ",EditExclude listing,$5.95Fixed price,$4.800% Free shipping,1,$5.95,–,"Jul 16, 2022"
4,", preview full size image1 IKEA Drawer Runner 12.5"" Mikael Computer Workstation Plastic White Part#1075811 IKEA Drawer Runner 12.5"" Mikael Computer Workstation Plastic White Part#107581",EditExclude listing,$6.99Fixed price,$5.250% Free shipping,1,$6.99,–,"Jul 16, 2022"
5,", preview full size imageIkea 4x Flat top metric screws, Part # 123756 (4 pack) - NEW FAST SHIPPING USAIkea 4x Flat top metric screws, Part # 123756 (4 pack) - NEW FAST SHIPPING USA",EditExclude listing,$11.69Fixed price,$0.00100% Free shipping,7,$81.83,–,"Jul 15, 2022"
6,", preview full size image2 IKEA Hardware Part # 1237862 IKEA Hardware Part # 123786",EditSell SimilarExclude listing,$14.99Fixed price,$0.00100% Free shipping,12,$179.88,–,"Jul 15, 2022"
7,", preview full size image6x IKEA Runners / Rails 16 1/4""  Plastic, White For Trofast Frame Part # 1200566x IKEA Runners / Rails 16 1/4""  Plastic, White For Trofast Frame Part # 120056",EditExclude listing,$19.99Fixed price,$14.750% Free shipping,4,$79.96,–,"Jul 14, 2022"
8,", preview full size imageIkea 4x Cross dowel nut sleeve, Part # 100505 FREE FAST SHIPPINGIkea 4x Cross dowel nut sleeve, Part # 100505 FREE FAST SHIPPING",EditExclude listing,$8.66Fixed price,$0.00100% Free shipping,3,$25.97,–,"Jul 14, 2022"
9,", preview full size imageIKEA Wire Nails 25mm length & Nail Holder Part #101221 & 105494IKEA Wire Nails 25mm length & Nail Holder Part #101221 & 105494",EditExclude listing,$7.49Fixed price,$3.990% Free shipping,2,$14.98,–,"Jul 14, 2022"
10,", preview full size image120 x ikea shelf pins part 11534120 x ikea shelf pins part 11534",EditExclude listing,$90.00Fixed price,$10.000% Free shipping,1,$90.00,–,"Jul 14, 2022"
11,", preview full size image(1) x IKEA Set of # 124449 and  #124450 For ALGOT containers replacement parts(1) x IKEA Set of # 124449 and  #124450 For ALGOT containers replacement parts",EditExclude listing,$5.64Fixed price,$5.350% Free shipping,82,$462.16,–,"Jul 13, 2022"
12,", preview full size image(1) x IKEA plastic cam lock nut Replacement Part selection(1) x IKEA plastic cam lock nut Replacement Part selection",EditExclude listing,$1.20Fixed price,$4.655% Free shipping,115,$137.52,–,"Jul 13, 2022"
13,", preview full size image24 Pack IKEA Besta Shelf Support Brackets 115443/4 Replacement Parts24 Pack IKEA Besta Shelf Support Brackets 115443/4 Replacement Parts",EditExclude listing,$15.00Fixed price,$5.000% Free shipping,1,$15.00,–,"Jul 13, 2022"
14,", preview full size imageIKEA Shelf support pins pegs brackets holders inserts replacement partsIKEA Shelf support pins pegs brackets holders inserts replacement parts",EditExclude listing,$1.61Fixed price,$5.970% Free shipping,"1,414","$2,281.96",–,"Jul 12, 2022"
15,", preview full size image2 IKEA 25 mm Caster Wheels, Fixed, Steel, Gray + 4 Screws Part # 111402 1090412 IKEA 25 mm Caster Wheels, Fixed, Steel, Gray + 4 Screws Part # 111402 109041",EditExclude listing,$9.99Fixed price,$5.500% Free shipping,1,$9.99,–,"Jul 12, 2022"
16,", preview full size image(1) x IKEA ALEX WHITE front drawer’s panel replacement part small or big(1) x IKEA ALEX WHITE front drawer’s panel replacement part small or big",EditExclude listing,$21.03Fixed price,$8.820% Free shipping,11,$231.35,–,"Jul 12, 2022"
17,", preview full size image1x IKEA SODERHAMN  Sofa Leg w/ Post 6 1/2"" Height, Steel, Chrome Part # 1241491x IKEA SODERHAMN  Sofa Leg w/ Post 6 1/2"" Height, Steel, Chrome Part # 124149",EditExclude listing,$12.99Fixed price,$13.420% Free shipping,3,$38.97,–,"Jul 12, 2022"
18,", preview full size image1 IKEA Cylinder Fastener Screw Hardware Replacement Part # 1245751 IKEA Cylinder Fastener Screw Hardware Replacement Part # 124575",EditSell SimilarExclude listing,$5.95Fixed price,$5.250% Free shipping,2,$11.90,–,"Jul 11, 2022"
19,", preview full size image(1) x IKEA MALM Low Frame Hardware Replacement Parts for Assembling any Size Bed(1) x IKEA MALM Low Frame Hardware Replacement Parts for Assembling any Size Bed",EditExclude listing,$32.06Fixed price,$10.990% Free shipping,8,$256.47,–,"Jul 11, 2022"
20,", preview full size imagePack of 8 IKEA Keyhole Suspension Fitting Replacement Part # 124529  Free ShipPack of 8 IKEA Keyhole Suspension Fitting Replacement Part # 124529  Free Ship",EditExclude listing,$12.95Fixed price,$0.00100% Free shipping,1,$12.95,–,"Jul 11, 2022"
21,", preview full size imageIkea 2x Part # 117615, 100413 HEMNES knobs metal 32 mm w screws - Fast ShippingIkea 2x Part # 117615, 100413 HEMNES knobs metal 32 mm w screws - Fast Shipping",EditExclude listing,$14.77Fixed price,$0.00100% Free shipping,2,$29.54,–,"Jul 11, 2022"
22,", preview full size imageIKEA KURA reversible Bed Frame Replacement parts Hardwares for Bed Assembly NEWIKEA KURA reversible Bed Frame Replacement parts Hardwares for Bed Assembly NEW",EditExclude listing,$6.36Fixed price,$4.350% Free shipping,67,$426.23,–,"Jul 10, 2022"
23,", preview full size image(4) x IKEA # 121236 Square KIVIK Sofa Legs  Plastic Black Replacement Parts(4) x IKEA # 121236 Square KIVIK Sofa Legs  Plastic Black Replacement Parts",EditExclude listing,$21.00Fixed price,$9.100% Free shipping,5,$104.98,–,"Jul 10, 2022"
24,", preview full size image(2) x IKEA #124438 white plastic connecting bracket replacement parts(2) x IKEA #124438 white plastic connecting bracket replacement parts",EditExclude listing,$8.99Fixed price,$5.200% Free shipping,2,$17.98,–,"Jul 10, 2022"
25,", preview full size image9 Ikea Wood Dowels Part # 101357 / 1288339 Ikea Wood Dowels Part # 101357 / 128833",EditExclude listing,$6.31Fixed price,$3.580% Free shipping,3,$18.93,–,"Jul 10, 2022"
26,", preview full size image(1) x IKEA # 147570 New file holder for Hemnes Desk and others Replacement Part(1) x IKEA # 147570 New file holder for Hemnes Desk and others Replacement Part",EditExclude listing,$12.16Fixed price,$7.300% Free shipping,7,$85.09,–,"Jul 10, 2022"
27,", preview full size image(2) x IKEA # 147191 New Drawer To Rail Plastic White Replacement Parts(2) x IKEA # 147191 New Drawer To Rail Plastic White Replacement Parts",EditExclude listing,$6.38Fixed price,$6.160% Free shipping,16,$102.04,–,"Jul 10, 2022"
28,", preview full size image(1) X IKEA Slat Board For Lonset Slatted Base Size Full replacement Part(1) X IKEA Slat Board For Lonset Slatted Base Size Full replacement Part",EditExclude listing,$6.62Fixed price,$18.910% Free shipping,6,$39.74,–,"Jul 10, 2022"
29,", preview full size imageIKEA 1 PAIR OF CONCEALED SLIDES 15 1/2"", 1 LEFT & 1 RIGHT,  PART # 125325 125326IKEA 1 PAIR OF CONCEALED SLIDES 15 1/2"", 1 LEFT & 1 RIGHT,  PART # 125325 125326",EditExclude listing,$20.00Fixed price,$17.700% Free shipping,1,$20.00,–,"Jul 10, 2022"
30,", preview full size image4 SILVER Finish Ikea Caps Part 100673 / 1954734 SILVER Finish Ikea Caps Part 100673 / 195473",EditSell SimilarExclude listing,$12.95Fixed price,$3.750% Free shipping,1,$12.95,–,"Jul 9, 2022"
31,", preview full size imageIKEA New couch connecting replacement partsIKEA New couch connecting replacement parts",EditExclude listing,$15.92Fixed price,$5.890% Free shipping,36,$572.96,–,"Jul 9, 2022"
32,", preview full size imageIKEA MALM BED FRAME REPLACEMENT PARTS HARDWARE LOW VERSION  KING QUEEN FULL TWINIKEA MALM BED FRAME REPLACEMENT PARTS HARDWARE LOW VERSION  KING QUEEN FULL TWIN",EditExclude listing,$38.99Fixed price,$14.450% Free shipping,2,$77.98,–,"Jul 8, 2022"
33,", preview full size image2 IKEA 25 mm Caster Wheels, Fixed, Steel, Gray + 4 Screws Part # 111402 1090412 IKEA 25 mm Caster Wheels, Fixed, Steel, Gray + 4 Screws Part # 111402 109041",EditExclude listing,$8.99Fixed price,$5.380% Free shipping,2,$17.98,–,"Jul 8, 2022"
34,", preview full size imageReplacement Self Tapping Screws for IKEA Part 130507 (MALM & Other) (Pack of 12)Replacement Self Tapping Screws for IKEA Part 130507 (MALM & Other) (Pack of 12)",EditExclude listing,$17.09Fixed price,$4.800% Free shipping,1,$17.09,–,"Jul 8, 2022"
35,", preview full size image2x Ikea Nut Metric Sleeves P M8 Hex5 15mm Length Steel Part # 1048642x Ikea Nut Metric Sleeves P M8 Hex5 15mm Length Steel Part # 104864",EditExclude listing,$8.99Fixed price,$5.100% Free shipping,1,$8.99,–,"Jul 8, 2022"
36,", preview full size image(1) x IKEA #146654 # 146655 New screw for Poäng chair replacement part(1) x IKEA #146654 # 146655 New screw for Poäng chair replacement part",EditExclude listing,$8.99Fixed price,$4.500% Free shipping,6,$53.94,–,"Jul 8, 2022"
37,", preview full size image3x IKEA Washers Spacer Discs Round Plastic Black Part # 1023193x IKEA Washers Spacer Discs Round Plastic Black Part # 102319",EditExclude listing,$4.99Fixed price,$4.900% Free shipping,2,$9.98,–,"Jul 8, 2022"
38,", preview full size image(4) x IKEA Angled Retainer / Support for Bjursta Extendable Table PART # 117583(4) x IKEA Angled Retainer / Support for Bjursta Extendable Table PART # 117583",EditExclude listing,$22.50Fixed price,$11.850% Free shipping,1,$22.50,–,"Jul 8, 2022"
39,", preview full size imageIKEA ASKVOLL Bed Frame Replacement parts Hardwares for Bed Assembly NEWIKEA ASKVOLL Bed Frame Replacement parts Hardwares for Bed Assembly NEW",EditExclude listing,$6.55Fixed price,$4.420% Free shipping,21,$137.64,–,"Jul 8, 2022"
40,", preview full size image(1) x IKEA #  100505 # 113153 NEW Cross Dowel Nut Sleeve Replacement Part(1) x IKEA #  100505 # 113153 NEW Cross Dowel Nut Sleeve Replacement Part",EditExclude listing,$7.68Fixed price,$6.950% Free shipping,16,$122.94,–,"Jul 8, 2022"
41,", preview full size image1 Ikea Base Support Border/ Corner Fitting for Kejsarkrona Steel PART# 1182541 Ikea Base Support Border/ Corner Fitting for Kejsarkrona Steel PART# 118254",EditExclude listing,$9.99Fixed price,$16.550% Free shipping,6,$59.94,–,"Jul 8, 2022"
42,", preview full size image(1) x IKEA # 157306 # 157307 New Clothes Rail Tube Bracket Support Plastic Part(1) x IKEA # 157306 # 157307 New Clothes Rail Tube Bracket Support Plastic Part",EditExclude listing,$6.85Fixed price,$5.620% Free shipping,13,$89.04,–,"Jul 8, 2022"
43,", preview full size image8, 4, 2, 1 Genuine IKEA Cam Lock Screws Part #1234928, 4, 2, 1 Genuine IKEA Cam Lock Screws Part #123492",EditExclude listing,$3.50Fixed price,$3.480% Free shipping,6,$20.98,–,"Jul 7, 2022"
44,", preview full size image(1) x IKEA # 144258 or #144259 New drawer rail soft closing Replacement part(1) x IKEA # 144258 or #144259 New drawer rail soft closing Replacement part",EditExclude listing,$9.45Fixed price,$7.8514% Free shipping,41,$387.49,–,"Jul 7, 2022"
45,", preview full size imageIKEA Screw Set Part # 153312 153307 For SKADIS Pegboard Gray ReplacementIKEA Screw Set Part # 153312 153307 For SKADIS Pegboard Gray Replacement",EditExclude listing,$9.82Fixed price,$0.00100% Free shipping,7,$68.73,–,"Jul 6, 2022"
46,", preview full size imageIKEA Replacement Part #123026  Cam Lock Fastener Screw Furniture Hardware PartsIKEA Replacement Part #123026  Cam Lock Fastener Screw Furniture Hardware Parts",EditExclude listing,$8.99Fixed price,$0.00100% Free shipping,1,$8.99,–,"Jul 6, 2022"
47,", preview full size image(1) x IKEA # 112976 Side Support Bracket for Day Bed Frame replacement part(1) x IKEA # 112976 Side Support Bracket for Day Bed Frame replacement part",EditExclude listing,$31.50Fixed price,$31.0350% Free shipping,4,$126.00,–,"Jul 6, 2022"
48,", preview full size imageIKEA KOPPANG Replacement partsIKEA KOPPANG Replacement parts",EditExclude listing,$26.32Fixed price,$9.900% Free shipping,8,$210.56,–,"Jul 6, 2022"
49,", preview full size imageIkea Screws, Part # 100214 / 100219 (4 pack) - NEWIkea Screws, Part # 100214 / 100219 (4 pack) - NEW",EditSell SimilarExclude listing,$9.99Fixed price,$0.00100% Free shipping,2,$19.98,–,"Jul 6, 2022"
0,", preview full size image(1) x IKEA set of replacement parts for SVÄRTA bed(1) x IKEA set of replacement parts for SVÄRTA bed",EditExclude listing,$60.00Fixed price,$11.600% Free shipping,1,$60.00,–,"Jul 6, 2022"
1,", preview full size image(1) x IKEA # 112978 Side Support Bracket for Bed Frame replacement part(1) x IKEA # 112978 Side Support Bracket for Bed Frame replacement part",EditExclude listing,$29.75Fixed price,$24.2313% Free shipping,8,$238.00,–,"Jul 6, 2022"
2,", preview full size image6 IKEA Screws Part # 1003446 IKEA Screws Part # 100344",EditExclude listing,$8.99Fixed price,$0.00100% Free shipping,1,$8.99,–,"Jul 5, 2022"
3,", preview full size image(1) x Set Of IKEA Bed Base Support Corner Connector # 141250 Replacement Parts(1) x Set Of IKEA Bed Base Support Corner Connector # 141250 Replacement Parts",EditExclude listing,$26.99Fixed price,$11.850% Free shipping,1,$26.99,–,"Jul 5, 2022"
4,", preview full size image(1) x IKEA # 139537 Side Support Bracket for Bed Frame replacement part(1) x IKEA # 139537 Side Support Bracket for Bed Frame replacement part",EditExclude listing,$31.50Fixed price,$0.00100% Free shipping,2,$63.00,–,"Jul 5, 2022"
5,", preview full size image8x Ikea Plastic connecting dowels, Part # 110519, white (8 pack) - NEW8x Ikea Plastic connecting dowels, Part # 110519, white (8 pack) - NEW",EditSell SimilarExclude listing,$10.99Fixed price,$0.00100% Free shipping,1,$10.99,–,"Jul 4, 2022"
6,", preview full size image(2) x IKEA # 108001 Assembly Dowel Wood Thread Fastener Screws Replacement Parts(2) x IKEA # 108001 Assembly Dowel Wood Thread Fastener Screws Replacement Parts",EditExclude listing,$4.56Fixed price,$5.410% Free shipping,22,$100.30,–,"Jul 4, 2022"
7,", preview full size image2x IKEA PIN Connector 50mm Steel part # 1237862x IKEA PIN Connector 50mm Steel part # 123786",EditExclude listing,$12.99Fixed price,$5.450% Free shipping,2,$25.98,–,"Jul 4, 2022"
8,", preview full size imageBilly Bookshelf Pins Replacement For IKEA Part 131372 Pack Of 12 Silver NEWBilly Bookshelf Pins Replacement For IKEA Part 131372 Pack Of 12 Silver NEW",EditExclude listing,$14.37Fixed price,$0.00100% Free shipping,1,$14.37,–,"Jul 4, 2022"
9,", preview full size image(14) x IKEA # 131295 NEW Shelf support Pins Replacement Parts(14) x IKEA # 131295 NEW Shelf support Pins Replacement Parts",EditExclude listing,$27.00Fixed price,$5.500% Free shipping,1,$27.00,–,"Jul 4, 2022"
10,", preview full size image(1) x IKEA ALEX front small drawer panel replacement part(1) x IKEA ALEX front small drawer panel replacement part",EditExclude listing,$21.38Fixed price,$9.500% Free shipping,2,$42.75,–,"Jul 3, 2022"
11,", preview full size image1 IKEA Partially Threaded Rod / Pin,  Part # 117175 - Additional rods ship free1 IKEA Partially Threaded Rod / Pin,  Part # 117175 - Additional rods ship free",EditExclude listing,$5.62Fixed price,$3.950% Free shipping,3,$16.85,–,"Jul 3, 2022"
12,", preview full size image(2) x IKEA #124438 white plastic connecting bracket replacement part(2) x IKEA #124438 white plastic connecting bracket replacement part",EditExclude listing,$8.99Fixed price,$18.000% Free shipping,2,$17.98,–,"Jul 3, 2022"
