,Listing,Actions,Avg Sold Price,Avg Shipping,Total Sold,Item_Sale,Bids,Date Last Sold
4,", preview full size imageIKEA Part # 146957 SET OF 2 connectors for VIDGA Curtain Panel Track ReplacementIKEA Part # 146957 SET OF 2 connectors for VIDGA Curtain Panel Track Replacement",EditExclude listing,$29.99Fixed price,$8.600% Free shipping,4,$119.96,–,"Feb 18, 2023"
5,", preview full size imageIKEA wood dowels (11) Part 101345; 1 3/16"" MALM, BRIMNES, HEMNES, TARVA, BRUSALIIKEA wood dowels (11) Part 101345; 1 3/16"" MALM, BRIMNES, HEMNES, TARVA, BRUSALI",EditExclude listing,$3.50Fixed price,$5.050% Free shipping,1,$3.50,–,"Feb 17, 2023"
6,", preview full size imageIKEA Cross Dowel Nut Sleeve (8 pack) Part # 104895 Furniture Hardware FittingsIKEA Cross Dowel Nut Sleeve (8 pack) Part # 104895 Furniture Hardware Fittings",EditExclude listing,$11.55Fixed price,$0.00100% Free shipping,8,$92.40,–,"Feb 17, 2023"
7,", preview full size image1 set IKEA # 114930 New Box Corner Wall Anti-Tip Brackets Set Replacement Parts1 set IKEA # 114930 New Box Corner Wall Anti-Tip Brackets Set Replacement Parts",EditExclude listing,$5.94Fixed price,$18.600% Free shipping,2,$11.88,–,"Feb 16, 2023"
8,", preview full size image1 each Ikea Allen Key Wrench Part 100092 + 108490 (Two parts total)1 each Ikea Allen Key Wrench Part 100092 + 108490 (Two parts total)",EditExclude listing,$6.95Fixed price,$17.280% Free shipping,2,$13.90,–,"Feb 14, 2023"
9,", preview full size imageIKEA Part  111401 Wheel Castor Caster (4 pack) for MALM BRIMNESIKEA Part  111401 Wheel Castor Caster (4 pack) for MALM BRIMNES",EditExclude listing,$11.99Fixed price,$4.990% Free shipping,1,$11.99,–,"Feb 13, 2023"
10,", preview full size imageIkea Bed extendable cross brace, Part # 117228 (4 pack) - NEWIkea Bed extendable cross brace, Part # 117228 (4 pack) - NEW",EditExclude listing,$35.78Fixed price,$19.700% Free shipping,1,$35.78,–,"Feb 13, 2023"
11,", preview full size image8 New Ikea Ogee Bevel Washers  Part # 1269168 New Ikea Ogee Bevel Washers  Part # 126916",EditSell SimilarExclude listing,$4.95Fixed price,$3.950% Free shipping,1,$4.95,–,"Feb 12, 2023"
12,", preview full size imageIKEA Pin Connector Part # 123786 (2 Pack) 50mm Furniture Hardware Fittings PartsIKEA Pin Connector Part # 123786 (2 Pack) 50mm Furniture Hardware Fittings Parts",EditExclude listing,$9.48Fixed price,$0.00100% Free shipping,1,$9.48,–,"Feb 12, 2023"
13,", preview full size image2 IKEA Spare Part # 128866 (PAX HASVIK GRIMO ) Stopper Catch Sliding2 IKEA Spare Part # 128866 (PAX HASVIK GRIMO ) Stopper Catch Sliding",EditExclude listing,$14.00Fixed price,$0.00100% Free shipping,1,$14.00,–,"Feb 12, 2023"
14,", preview full size imageIkea BLACK FINISH Cam Lock Nuts Eccentric Part 102533 / 102534 - Pk 2, 6, or 12Ikea BLACK FINISH Cam Lock Nuts Eccentric Part 102533 / 102534 - Pk 2, 6, or 12",EditSell SimilarExclude listing,$6.09Fixed price,$6.910% Free shipping,4,$24.35,–,"Feb 12, 2023"
15,", preview full size image1 New Ikea Flat Head Pin or Screw, Part # 1052371 New Ikea Flat Head Pin or Screw, Part # 105237",EditExclude listing,$6.50Fixed price,$5.250% Free shipping,1,$6.50,–,"Feb 12, 2023"
16,", preview full size image2x Ikea Nut Metric Sleeves C M6 22mm length x 10mm Width Hex5 Steel Part# 1190362x Ikea Nut Metric Sleeves C M6 22mm length x 10mm Width Hex5 Steel Part# 119036",EditExclude listing,$4.99Fixed price,$5.130% Free shipping,5,$24.95,–,"Feb 12, 2023"
17,", preview full size image5 Ikea Cylinder Sofa Legs w/ M8 Post 2 1 /2"" Total HT Plastic, Black PART 1414545 Ikea Cylinder Sofa Legs w/ M8 Post 2 1 /2"" Total HT Plastic, Black PART 141454",EditExclude listing,$19.99Fixed price,$6.650% Free shipping,1,$19.99,–,"Feb 11, 2023"
18,", preview full size image2 IKEA Connecting Support Part # 1236602 IKEA Connecting Support Part # 123660",EditExclude listing,$9.99Fixed price,$0.00100% Free shipping,3,$29.97,–,"Feb 11, 2023"
19,", preview full size image3x Ikea Metric Screw Flat M4 MLKX 21mm Steel Part # 1004113x Ikea Metric Screw Flat M4 MLKX 21mm Steel Part # 100411",EditSell SimilarExclude listing,$5.99Fixed price,$5.100% Free shipping,1,$5.99,–,"Feb 11, 2023"
20,", preview full size image2 Ikea BLACK FINISH Socket Metric Head Screws Bolts Pins Part # 1053232 Ikea BLACK FINISH Socket Metric Head Screws Bolts Pins Part # 105323",EditSell SimilarExclude listing,$7.95Fixed price,$4.750% Free shipping,2,$15.90,–,"Feb 11, 2023"
21,", preview full size image8 IKEA Wood Screws, Part 109567 - Additional quantities ship free!8 IKEA Wood Screws, Part 109567 - Additional quantities ship free!",EditExclude listing,$6.45Fixed price,$3.790% Free shipping,6,$38.70,–,"Feb 11, 2023"
22,", preview full size imageIKEA PARTS - Hemnes Daybed Nut Sleeve #108903 - 4 Pack FURNITURE PARTSIKEA PARTS - Hemnes Daybed Nut Sleeve #108903 - 4 Pack FURNITURE PARTS",EditExclude listing,$4.11Fixed price,$5.790% Free shipping,5,$20.55,–,"Feb 11, 2023"
23,", preview full size imagePack of 5 IKEA Plastic Caps Hole Plugs Part # 115345 - White - Fits Pax WardrobePack of 5 IKEA Plastic Caps Hole Plugs Part # 115345 - White - Fits Pax Wardrobe",EditExclude listing,$3.50Fixed price,$3.750% Free shipping,1,$3.50,–,"Feb 10, 2023"
24,", preview full size imageIKEA Parts - Besta Shelf PIns  (12 Pack)IKEA Parts - Besta Shelf PIns  (12 Pack)",EditExclude listing,$8.39Fixed price,$6.430% Free shipping,12,$100.68,–,"Feb 9, 2023"
25,", preview full size image2 IKEA Nut Metric Sleeves Part # 104864 + FREE IKEA BAG. Shipping From the USA2 IKEA Nut Metric Sleeves Part # 104864 + FREE IKEA BAG. Shipping From the USA",EditExclude listing,$10.56Fixed price,$0.00100% Free shipping,22,$232.24,–,"Feb 9, 2023"
26,", preview full size image4x IKEA Screws 30MM PART # 1100044x IKEA Screws 30MM PART # 110004",EditExclude listing,$4.99Fixed price,$9.430% Free shipping,5,$24.95,–,"Feb 8, 2023"
27,", preview full size imageIKEA Screws Part # 100343 (6 pack) Furniture Hardware Fittings PartsIKEA Screws Part # 100343 (6 pack) Furniture Hardware Fittings Parts",EditExclude listing,$9.76Fixed price,$0.00100% Free shipping,7,$68.33,–,"Feb 7, 2023"
28,", preview full size imageIKEA Part  (2 Pack) Ikea Table Fittings Same Day Shipping From the USAIKEA Part  (2 Pack) Ikea Table Fittings Same Day Shipping From the USA",EditExclude listing,$9.99Fixed price,$4.500% Free shipping,1,$9.99,–,"Feb 7, 2023"
29,", preview full size imageIKEA Part Number 100325 (6 pack) Replacement Screws Hardware FittingsIKEA Part Number 100325 (6 pack) Replacement Screws Hardware Fittings",EditExclude listing,$11.39Fixed price,$0.00100% Free shipping,2,$22.78,–,"Feb 6, 2023"
30,", preview full size image4x IKEA Threaded Pins SCREWS  M8 63mm Ikea Part # 100037 1000334x IKEA Threaded Pins SCREWS  M8 63mm Ikea Part # 100037 100033",EditExclude listing,$9.99Fixed price,$6.980% Free shipping,22,$219.78,–,"Feb 6, 2023"
31,", preview full size imageIKEA Screw Part # 153311 For SKADIS Pegboard White (6 pack) Replacement FittingsIKEA Screw Part # 153311 For SKADIS Pegboard White (6 pack) Replacement Fittings",EditExclude listing,$15.00Fixed price,$0.00100% Free shipping,1,$15.00,–,"Feb 6, 2023"
32,", preview full size imageIKEA 110912 (2 pack)  Part Cross Dowel Nut Dual Same Day Shipping From the USAIKEA 110912 (2 pack)  Part Cross Dowel Nut Dual Same Day Shipping From the USA",EditExclude listing,$12.99Fixed price,$4.990% Free shipping,1,$12.99,–,"Feb 6, 2023"
33,", preview full size image2x Ikea Nut Metric Sleeves P M8 Hex5 21mm Length Steel Part # 1016692x Ikea Nut Metric Sleeves P M8 Hex5 21mm Length Steel Part # 101669",EditSell SimilarExclude listing,$8.88Fixed price,$5.640% Free shipping,9,$79.91,–,"Feb 5, 2023"
34,", preview full size image4 x Ikea Furniture Besta Frame Bookcase Joining Connector Bolt Screw Part 1146674 x Ikea Furniture Besta Frame Bookcase Joining Connector Bolt Screw Part 114667",EditExclude listing,$6.90Fixed price,$0.00100% Free shipping,1,$6.90,–,"Feb 5, 2023"
35,", preview full size image2x IKEA Bond Shelf  Supports with Pre-Assembled Screw Part # 106402 1064012x IKEA Bond Shelf  Supports with Pre-Assembled Screw Part # 106402 106401",EditExclude listing,$9.99Fixed price,$5.160% Free shipping,4,$39.96,–,"Feb 5, 2023"
36,", preview full size image5 Ikea Cam Lock Screws Fasteners Bolts Hardware Replacement Part 1129965 Ikea Cam Lock Screws Fasteners Bolts Hardware Replacement Part 112996",EditExclude listing,$4.50Fixed price,$13.200% Free shipping,1,$4.50,–,"Feb 4, 2023"
37,", preview full size image4 New IKEA Screws Part # 107624 Phillips head4 New IKEA Screws Part # 107624 Phillips head",EditExclude listing,$5.70Fixed price,$4.430% Free shipping,8,$45.60,–,"Feb 4, 2023"
38,", preview full size imageIkea HEMNES Drawer knobs metal 32 mm, 1.25” Width Part # 117615 (4 pack) - NEWIkea HEMNES Drawer knobs metal 32 mm, 1.25” Width Part # 117615 (4 pack) - NEW",EditExclude listing,$14.71Fixed price,$0.00100% Free shipping,7,$103.00,–,"Feb 2, 2023"
39,", preview full size image1 New IKEA # 142606 White Plastic Part fits Bekant Desk1 New IKEA # 142606 White Plastic Part fits Bekant Desk",EditExclude listing,$5.95Fixed price,$3.750% Free shipping,1,$5.95,–,"Feb 1, 2023"
40,", preview full size imageIkea MALM Bed Frame Hardware Parts ONLY High - Queen or Full - 82 Pieces Ikea MALM Bed Frame Hardware Parts ONLY High - Queen or Full - 82 Pieces ",EditExclude listing,$49.99Fixed price,$10.400% Free shipping,2,$99.98,–,"Feb 1, 2023"
41,", preview full size imageIkea Metal Cam Lock Nuts Hardware Part # 103430 / 122741 - pks of 2, 4, 8, or 12Ikea Metal Cam Lock Nuts Hardware Part # 103430 / 122741 - pks of 2, 4, 8, or 12",EditSell SimilarExclude listing,$6.79Fixed price,$4.300% Free shipping,23,$156.25,–,"Feb 1, 2023"
42,", preview full size imageIKEA White Plastic Anchor Replacement PartsIKEA White Plastic Anchor Replacement Parts",EditExclude listing,$6.99Fixed price,$4.980% Free shipping,1,$6.99,–,"Feb 1, 2023"
43,", preview full size imageIkea Bed extendable cross brace, Part # 117228 (4 pack) - NEWIkea Bed extendable cross brace, Part # 117228 (4 pack) - NEW",EditExclude listing,$44.99Fixed price,$12.990% Free shipping,2,$89.98,–,"Feb 1, 2023"
44,", preview full size imageIkea HEMNES knobs metal 32 mm w/ screws, Part # 117615, (2 pack) - Take offsIkea HEMNES knobs metal 32 mm w/ screws, Part # 117615, (2 pack) - Take offs",EditSell SimilarExclude listing,$9.00Fixed price,$5.650% Free shipping,1,$9.00,–,"Jan 31, 2023"
45,", preview full size imageIKEA PARTS - Komplement Shelf Pins #115344 (12 Pack)IKEA PARTS - Komplement Shelf Pins #115344 (12 Pack)",EditExclude listing,$6.56Fixed price,$4.500% Free shipping,4,$26.22,–,"Jan 31, 2023"
46,", preview full size image1x IKEA Sliding Door Runner, Left  for PAX Wardrobe Part # 1243351x IKEA Sliding Door Runner, Left  for PAX Wardrobe Part # 124335",EditExclude listing,$9.99Fixed price,$6.650% Free shipping,1,$9.99,–,"Jan 30, 2023"
47,", preview full size imageReplacement Wooden Dowel Pins for IKEA Part 101351 (BILLY, SUNDVIK) (Pack of 8)Replacement Wooden Dowel Pins for IKEA Part 101351 (BILLY, SUNDVIK) (Pack of 8)",EditSell SimilarExclude listing,$7.45Fixed price,$0.00100% Free shipping,11,$81.95,–,"Jan 29, 2023"
48,", preview full size imageIKEA Cam Lock Nuts Part # 103114 (4 pack) Furniture Hardware Parts FittingsIKEA Cam Lock Nuts Part # 103114 (4 pack) Furniture Hardware Parts Fittings",EditExclude listing,$7.95Fixed price,$0.00100% Free shipping,26,$206.76,–,"Jan 29, 2023"
49,", preview full size image2 IKEA Chair Mounting Bracket Support Part # 1226202 IKEA Chair Mounting Bracket Support Part # 122620",EditSell SimilarExclude listing,$9.99Fixed price,$0.00100% Free shipping,10,$99.90,–,"Jan 28, 2023"
0,", preview full size imageNEW! Ikea HEMNES Drawer knobs metal 32 mm, Part # 117615 - 3 knobs with HardwareNEW! Ikea HEMNES Drawer knobs metal 32 mm, Part # 117615 - 3 knobs with Hardware",EditExclude listing,$7.00Fixed price,$7.000% Free shipping,1,$7.00,–,"Jan 28, 2023"
1,", preview full size imageIKEA Cam Lock Screw (12); Part 112614; HAVSTA, BUSALI, SUNDVIKIKEA Cam Lock Screw (12); Part 112614; HAVSTA, BUSALI, SUNDVIK",EditExclude listing,$8.50Fixed price,$5.000% Free shipping,1,$8.50,–,"Jan 28, 2023"
2,", preview full size imageIKEA 100215  Screws Part (8 Pack) Original. Same Day Shipping From USAIKEA 100215  Screws Part (8 Pack) Original. Same Day Shipping From USA",EditExclude listing,$4.08Fixed price,$26.200% Free shipping,4,$16.32,–,"Jan 28, 2023"
3,", preview full size imageIKEA Screws Part # 100400 (8 Pack) Replacement Furniture Hardware FittingIKEA Screws Part # 100400 (8 Pack) Replacement Furniture Hardware Fitting",EditExclude listing,$10.97Fixed price,$0.00100% Free shipping,7,$76.76,–,"Jan 27, 2023"
4,", preview full size imageIKEA Countersunk Pins Screws (2 Pack) Part # 154571 Replacement Hardware FittingIKEA Countersunk Pins Screws (2 Pack) Part # 154571 Replacement Hardware Fitting",EditExclude listing,$9.99Fixed price,$0.00100% Free shipping,1,$9.99,–,"Jan 27, 2023"
5,", preview full size imageIKEA 1 Leg for Ektorp Sofa 6 3/4” Tall Plastic Black Part # 121303 w Felt PadIKEA 1 Leg for Ektorp Sofa 6 3/4” Tall Plastic Black Part # 121303 w Felt Pad",EditExclude listing,$15.62Fixed price,$0.00100% Free shipping,13,$203.07,–,"Jan 27, 2023"
6,", preview full size image4 Ikea Cross Dowel Nut Sleeve Part # 1005144 Ikea Cross Dowel Nut Sleeve Part # 100514",EditSell SimilarExclude listing,$10.66Fixed price,$0.00100% Free shipping,6,$63.94,–,"Jan 27, 2023"
7,", preview full size imageIKEA Nut Part # 104864 (2 Packs) Metric Sleeves Furniture Hardware FittingsIKEA Nut Part # 104864 (2 Packs) Metric Sleeves Furniture Hardware Fittings",EditExclude listing,$13.16Fixed price,$0.00100% Free shipping,10,$131.64,–,"Jan 26, 2023"
8,", preview full size imageIKEA Part # 130900 130901 (2 pack) Spacer Disks Furniture Hardware Fitting WhiteIKEA Part # 130900 130901 (2 pack) Spacer Disks Furniture Hardware Fitting White",EditExclude listing,$9.99Fixed price,$0.00100% Free shipping,2,$19.98,–,"Jan 25, 2023"
9,", preview full size image4x Ikea Metric Screw Flat 30mm M4 Used in Drawer Handles Part # 1004164x Ikea Metric Screw Flat 30mm M4 Used in Drawer Handles Part # 100416",EditSell SimilarExclude listing,$6.49Fixed price,$4.950% Free shipping,2,$12.98,–,"Jan 25, 2023"
10,", preview full size image3x IKEA Threaded Pins SCREWS  M8 60mm Ikea Part # 100037 1000333x IKEA Threaded Pins SCREWS  M8 60mm Ikea Part # 100037 100033",EditExclude listing,$12.16Fixed price,$7.520% Free shipping,6,$72.94,–,"Jan 25, 2023"
11,", preview full size imageIkea Part 130650 Plastic tube cap. Set Of 2. Same Day Shipping From The USAIkea Part 130650 Plastic tube cap. Set Of 2. Same Day Shipping From The USA",EditExclude listing,$4.66Fixed price,$5.750% Free shipping,1,$4.66,–,"Jan 24, 2023"
12,", preview full size image12x Ikea Wood Dowels / Furniture Pegs 50mm x 6mm Part # 10133912x Ikea Wood Dowels / Furniture Pegs 50mm x 6mm Part # 101339",EditSell SimilarExclude listing,$8.99Fixed price,$4.560% Free shipping,4,$35.96,–,"Jan 24, 2023"
13,", preview full size image2 IKEA BLACK FINISH Bolts Screws Part # 121212 / 1229002 IKEA BLACK FINISH Bolts Screws Part # 121212 / 122900",EditExclude listing,$8.28Fixed price,$3.920% Free shipping,3,$24.85,–,"Jan 24, 2023"
14,", preview full size image10x IKEA BILLY BOOKCASE  Shelf Pins Pegs Supports Part # 13137210x IKEA BILLY BOOKCASE  Shelf Pins Pegs Supports Part # 131372",EditExclude listing,$10.99Fixed price,$5.280% Free shipping,7,$76.93,–,"Jan 24, 2023"
15,", preview full size image4x IKEA Table/Desk Leg Mount, For Adil Leg, Steel, Gray w/ 20 Screws Part 1042174x IKEA Table/Desk Leg Mount, For Adil Leg, Steel, Gray w/ 20 Screws Part 104217",EditExclude listing,$39.99Fixed price,$10.560% Free shipping,7,$279.93,–,"Jan 24, 2023"
16,", preview full size image(2) x IKEA Plastic Twist Turn Locking Mechanism Sektion Replacement Part# 124526(2) x IKEA Plastic Twist Turn Locking Mechanism Sektion Replacement Part# 124526",EditExclude listing,$3.55Fixed price,$4.900% Free shipping,7,$24.85,–,"Jan 23, 2023"
17,", preview full size imageIKEA PARTS - Cam Lock Nut #110630 (4 pack)IKEA PARTS - Cam Lock Nut #110630 (4 pack)",EditExclude listing,$5.90Fixed price,$3.800% Free shipping,5,$29.50,–,"Jan 23, 2023"
18,", preview full size imageReplacement Assembly Dowel / Cam Lock Screw for IKEA Part 123491 (MALM Beds) x 8Replacement Assembly Dowel / Cam Lock Screw for IKEA Part 123491 (MALM Beds) x 8",EditSell SimilarExclude listing,$10.87Fixed price,$0.00100% Free shipping,2,$21.73,–,"Jan 23, 2023"
19,", preview full size imageIkea Flat top metric screws, Part # 123756 (4-pack) - NEWIkea Flat top metric screws, Part # 123756 (4-pack) - NEW",EditSell SimilarExclude listing,$12.19Fixed price,$0.00100% Free shipping,3,$36.57,–,"Jan 22, 2023"
20,", preview full size image4X IKEA METRIC HEX5 SCREW COUNTERSUNK M8 30MM STEEL PART # 1001184X IKEA METRIC HEX5 SCREW COUNTERSUNK M8 30MM STEEL PART # 100118",EditSell SimilarExclude listing,$8.49Fixed price,$2.390% Free shipping,6,$50.94,–,"Jan 21, 2023"
21,", preview full size image1 Set Ikea Slide Rails Micke, Brimnes, Koppang 15"" Part# 10054765 112482 158933 1 Set Ikea Slide Rails Micke, Brimnes, Koppang 15"" Part# 10054765 112482 158933 ",EditExclude listing,$19.99Fixed price,$13.180% Free shipping,4,$79.96,–,"Jan 21, 2023"
22,", preview full size imageIkea Bed frame mounting plate w/ screws, Part # 116791, 110789 (Pack of 2) - NEWIkea Bed frame mounting plate w/ screws, Part # 116791, 110789 (Pack of 2) - NEW",EditExclude listing,$10.00Fixed price,$10.000% Free shipping,1,$10.00,–,"Jan 19, 2023"
23,", preview full size image4 IKEA Screws Part # 1001084 IKEA Screws Part # 100108",EditSell SimilarExclude listing,$12.99Fixed price,$0.00100% Free shipping,5,$64.95,–,"Jan 19, 2023"
24,", preview full size imageIKEA # 108903 SET of 4 Cross Dowel Nut Sleeve Original part. Same Day Ship USAIKEA # 108903 SET of 4 Cross Dowel Nut Sleeve Original part. Same Day Ship USA",EditExclude listing,$13.79Fixed price,$0.00100% Free shipping,9,$124.15,–,"Jan 18, 2023"
25,", preview full size image8 IKEA BLACK Furniture Screws Part 100229 / 100232 + 1 Allen Key Part # 1000068 IKEA BLACK Furniture Screws Part 100229 / 100232 + 1 Allen Key Part # 100006",EditExclude listing,$8.08Fixed price,$4.210% Free shipping,8,$64.60,–,"Jan 18, 2023"
26,", preview full size imageIKEA BRIMNES Handle Small Gray Furniture Part  # 130508 # 130509 # 10050606IKEA BRIMNES Handle Small Gray Furniture Part  # 130508 # 130509 # 10050606",EditExclude listing,$11.29Fixed price,$0.00100% Free shipping,18,$203.27,–,"Jan 18, 2023"
27,", preview full size imageIKEA Screws Part # 100402 (6 Pack) Furniture Hardware Fittings PartsIKEA Screws Part # 100402 (6 Pack) Furniture Hardware Fittings Parts",EditExclude listing,$12.23Fixed price,$0.00100% Free shipping,3,$36.69,–,"Jan 18, 2023"
28,", preview full size image4x IKEA Adil Table Leg Mount Plates, Steel, Red w/ 5 Screws Part# 104217 1084434x IKEA Adil Table Leg Mount Plates, Steel, Red w/ 5 Screws Part# 104217 108443",EditExclude listing,$39.99Fixed price,$10.600% Free shipping,1,$39.99,–,"Jan 18, 2023"
29,", preview full size imageIkea HEMNES Drawer knobs metal 32 mm, 1.25” Width Part # 117615 (4 pack) - NEWIkea HEMNES Drawer knobs metal 32 mm, 1.25” Width Part # 117615 (4 pack) - NEW",EditExclude listing,$14.75Fixed price,$0.00100% Free shipping,2,$29.50,–,"Jan 18, 2023"
30,", preview full size image1 Ikea Fold Down Hinge Part # 122654 For Hemnes Bureau & Hemnes Secretary desk1 Ikea Fold Down Hinge Part # 122654 For Hemnes Bureau & Hemnes Secretary desk",EditExclude listing,$5.58Fixed price,$6.750% Free shipping,11,$61.40,–,"Jan 17, 2023"
31,", preview full size imageIKEA Part # 120202 Sofa Tightening Tool Tube Wrench Furniture Hardware FittingsIKEA Part # 120202 Sofa Tightening Tool Tube Wrench Furniture Hardware Fittings",EditExclude listing,$10.94Fixed price,$0.00100% Free shipping,7,$76.59,–,"Jan 17, 2023"
32,", preview full size imageIKEA Part # 110019 (2 Pack) Screw Bolt KIVIK Sofa Replacement Furniture HardwareIKEA Part # 110019 (2 Pack) Screw Bolt KIVIK Sofa Replacement Furniture Hardware",EditExclude listing,$9.99Fixed price,$0.00100% Free shipping,1,$9.99,–,"Jan 17, 2023"
33,", preview full size image8 IKEA SILVER Furniture Screws Part 100229 / 100232 + 1 Allen Key Part # 1000068 IKEA SILVER Furniture Screws Part 100229 / 100232 + 1 Allen Key Part # 100006",EditExclude listing,$7.95Fixed price,$3.830% Free shipping,11,$87.45,–,"Jan 17, 2023"
34,", preview full size image2 New Ikea Pins Screws Part # 100230 / 105890 in SILVER Finish2 New Ikea Pins Screws Part # 100230 / 105890 in SILVER Finish",EditExclude listing,$8.75Fixed price,$4.580% Free shipping,4,$35.00,–,"Jan 16, 2023"
35,", preview full size image4 x Ikea Keyhole brackets, Part # 103693 - NEW4 x Ikea Keyhole brackets, Part # 103693 - NEW",EditExclude listing,$6.99Fixed price,$10.980% Free shipping,2,$13.98,–,"Jan 16, 2023"
36,", preview full size image3 Brackets Ikea Wall Mounting L, Part # 115753 2412 & Others Sektion Malm3 Brackets Ikea Wall Mounting L, Part # 115753 2412 & Others Sektion Malm",EditExclude listing,$12.99Fixed price,$4.980% Free shipping,3,$38.97,–,"Jan 16, 2023"
37,", preview full size imageIKEA Part # 100358 (6 Pack) Furniture Hardware Replacement PartsIKEA Part # 100358 (6 Pack) Furniture Hardware Replacement Parts",EditExclude listing,$10.18Fixed price,$0.00100% Free shipping,4,$40.70,–,"Jan 16, 2023"
38,", preview full size image1 each Ikea Allen Key Wrench Part 100001 + 100002 (Two parts total)1 each Ikea Allen Key Wrench Part 100001 + 100002 (Two parts total)",EditExclude listing,$6.50Fixed price,$9.400% Free shipping,1,$6.50,–,"Jan 16, 2023"
39,", preview full size imageEight IKEA White plastic connecting dowels - Part #110519 MALM HEMNES BREMNESEight IKEA White plastic connecting dowels - Part #110519 MALM HEMNES BREMNES",EditExclude listing,$6.00Fixed price,$4.800% Free shipping,1,$6.00,–,"Jan 16, 2023"
40,", preview full size image6 IKEA Wood Screws, Part 109567 - Additional quantities ship free!6 IKEA Wood Screws, Part 109567 - Additional quantities ship free!",EditExclude listing,$5.45Fixed price,$3.750% Free shipping,1,$5.45,–,"Jan 16, 2023"
41,", preview full size imageIKEA Bed Frame Screws Part # 117327 (6 pack) Furniture Hardware Parts FittingIKEA Bed Frame Screws Part # 117327 (6 pack) Furniture Hardware Parts Fitting",EditExclude listing,$9.02Fixed price,$0.00100% Free shipping,7,$63.11,–,"Jan 16, 2023"
42,", preview full size image8 Black Ikea Metric Pins Screws Fasteners Bolts Part # 1395568 Black Ikea Metric Pins Screws Fasteners Bolts Part # 139556",EditExclude listing,$10.95Fixed price,$3.750% Free shipping,1,$10.95,–,"Jan 16, 2023"
43,", preview full size image4 Black Ikea Metric Pins Screws Fasteners Bolts Part # 1395564 Black Ikea Metric Pins Screws Fasteners Bolts Part # 139556",EditSell SimilarExclude listing,$7.95Fixed price,$3.750% Free shipping,2,$15.90,–,"Jan 16, 2023"
44,", preview full size imageIKEA Plug Dowel (4 pack) Part # 130886 Furniture Hardware Fittings PartsIKEA Plug Dowel (4 pack) Part # 130886 Furniture Hardware Fittings Parts",EditExclude listing,$11.68Fixed price,$0.00100% Free shipping,5,$58.42,–,"Jan 16, 2023"
45,", preview full size image1x IKEA SOFA PIN Connector Steel part # 108116 FRIHETEN MANSTAD1x IKEA SOFA PIN Connector Steel part # 108116 FRIHETEN MANSTAD",EditExclude listing,$9.99Fixed price,$5.610% Free shipping,5,$49.95,–,"Jan 16, 2023"
46,", preview full size image1x IKEA Jerker DESK FRAME TUBE CAP COVER PLASTIC GREY PART # 1100931x IKEA Jerker DESK FRAME TUBE CAP COVER PLASTIC GREY PART # 110093",EditExclude listing,$9.99Fixed price,$5.600% Free shipping,2,$19.98,–,"Jan 15, 2023"
47,", preview full size image1 Ikea Pin Screw Bolt Part # 1065811 Ikea Pin Screw Bolt Part # 106581",EditExclude listing,$6.95Fixed price,$1.920% Free shipping,1,$6.95,–,"Jan 15, 2023"
48,", preview full size imageReplacement Wooden Dowel Pins for IKEA Part 101356 (SONGESAND, MALM) - Pack of 8Replacement Wooden Dowel Pins for IKEA Part 101356 (SONGESAND, MALM) - Pack of 8",EditSell SimilarExclude listing,$8.31Fixed price,$11.1750% Free shipping,2,$16.62,–,"Jan 15, 2023"
49,", preview full size imageIKEA Part # 102509 (4 Pack) ALEX Drawer Replacement Furniture Hardware FittingsIKEA Part # 102509 (4 Pack) ALEX Drawer Replacement Furniture Hardware Fittings",EditExclude listing,$10.03Fixed price,$0.00100% Free shipping,2,$20.06,–,"Jan 14, 2023"
0,", preview full size image2x IKEA M8 SCREWS + 2 CONNECTORS + 2 SPRING WASHERS PART # 100469 100843 1313372x IKEA M8 SCREWS + 2 CONNECTORS + 2 SPRING WASHERS PART # 100469 100843 131337",EditExclude listing,$19.99Fixed price,$5.750% Free shipping,2,$39.98,–,"Jan 14, 2023"
1,", preview full size image2 IKEA Pins/Screws, 2 Feet & 2 Mounting Nuts For PAX Part # 110618 110617 1007512 IKEA Pins/Screws, 2 Feet & 2 Mounting Nuts For PAX Part # 110618 110617 100751",EditExclude listing,$15.99Fixed price,$8.860% Free shipping,6,$95.94,–,"Jan 11, 2023"
2,", preview full size imageIKEA Pax Wardrobe Frame Foot Replacement Parts # 110618 # 110617IKEA Pax Wardrobe Frame Foot Replacement Parts # 110618 # 110617",EditExclude listing,$6.62Fixed price,$5.330% Free shipping,22,$145.74,–,"Jan 11, 2023"
3,", preview full size imageIKEA Part # 126888 (2 pack)  Replacement Furniture Parts Hardware FittingsIKEA Part # 126888 (2 pack)  Replacement Furniture Parts Hardware Fittings",EditExclude listing,$17.17Fixed price,$0.00100% Free shipping,6,$103.02,–,"Jan 11, 2023"
