,Listing,Actions,Avg Sold Price,Avg Shipping,Total Sold,Item_Sale,Bids,Date Last Sold
32,", preview full size image��Educational Toys Baby Tablet For 1-6 year old Boy Girl Learning & Playing Gift��Educational Toys Baby Tablet For 1-6 year old Boy Girl Learning & Playing Gift",EditExclude listing,$8.71Fixed price,$0.00100% Free shipping,8,$69.67,–,"Nov 18, 2022"
33,", preview full size imageEducational Toys Baby Tablet For 1-6 year old Boy Girl Learning & Playing GiftsEducational Toys Baby Tablet For 1-6 year old Boy Girl Learning & Playing Gifts",EditExclude listing,$10.31Fixed price,$0.00100% Free shipping,9,$92.83,–,"Nov 18, 2022"
34,", preview full size imageGirls First Birthday Gift Age 1 Toddler Piano Toy for 2 3 Year Old Baby Present Girls First Birthday Gift Age 1 Toddler Piano Toy for 2 3 Year Old Baby Present ",EditExclude listing,$31.41Fixed price,$0.00100% Free shipping,1,$31.41,–,"Nov 18, 2022"
35,", preview full size imageEducational Toy For 6 Months And 1 2 3 Year Old Boy Girl Toddler Musical Mat NEWEducational Toy For 6 Months And 1 2 3 Year Old Boy Girl Toddler Musical Mat NEW",EditExclude listing,$13.50Fixed price,$0.00100% Free shipping,2,$27.00,–,"Nov 18, 2022"
36,", preview full size imageToys for 1 2 3 Year Old Boys Girls Baby Toys 12-18 Months Early Educational AToys for 1 2 3 Year Old Boys Girls Baby Toys 12-18 Months Early Educational A",EditExclude listing,$29.53Fixed price,$0.00100% Free shipping,1,$29.53,–,"Nov 18, 2022"
37,", preview full size imageEducational Learning Musical Toy for Baby Toddler Kid 1 2 3 4 Year Old Boy GirlsEducational Learning Musical Toy for Baby Toddler Kid 1 2 3 4 Year Old Boy Girls",EditSell SimilarExclude listing,$16.74Fixed price,$0.00100% Free shipping,1,$16.74,–,"Nov 18, 2022"
38,", preview full size imageBaby Balance Bike Toys for 1 Year Old Boy and Girl Gifts One Year OldBaby Balance Bike Toys for 1 Year Old Boy and Girl Gifts One Year Old",EditSell SimilarExclude listing,$47.07Fixed price,$0.00100% Free shipping,1,$47.07,–,"Nov 18, 2022"
39,", preview full size imageEducational Toys Baby Tablet For 1-6 Year Old Toddler Learning Playing ToolsEducational Toys Baby Tablet For 1-6 Year Old Toddler Learning Playing Tools",EditExclude listing,$12.76Fixed price,$0.00100% Free shipping,1,$12.76,–,"Nov 17, 2022"
40,", preview full size imageEducational Tablet Toys For 1-6 Year Olds Toddlers Baby Kids Learning Gift NewEducational Tablet Toys For 1-6 Year Olds Toddlers Baby Kids Learning Gift New",EditExclude listing,$9.89Fixed price,$0.00100% Free shipping,10,$98.90,–,"Nov 17, 2022"
41,", preview full size imageToddler Girl Boy Toys,Magnetic Drawing Board Toddler Toys for 1-2-3 Year OldToddler Girl Boy Toys,Magnetic Drawing Board Toddler Toys for 1-2-3 Year Old",EditExclude listing,$24.95Fixed price,$17.100% Free shipping,1,$24.95,–,"Nov 17, 2022"
42,", preview full size imageBirthday Gifts For 35 Year Old Girls Boys Cute Stuff Toys For Age 35 Kids Apron Birthday Gifts For 35 Year Old Girls Boys Cute Stuff Toys For Age 35 Kids Apron ",EditExclude listing,$28.24Fixed price,$0.00100% Free shipping,3,$84.72,–,"Nov 17, 2022"
43,", preview full size imageDuck Toy - Musical Baby Toys for 1 Year Old Girl & Boy, Babies, Infant, toddlersDuck Toy - Musical Baby Toys for 1 Year Old Girl & Boy, Babies, Infant, toddlers",EditExclude listing,$29.00Fixed price,$0.00100% Free shipping,1,$29.00,–,"Nov 17, 2022"
44,", preview full size image2 in 1 Dinosaur Transforming Car Toys for 3 4 5 Year Old Boys Kids Birthday Gift2 in 1 Dinosaur Transforming Car Toys for 3 4 5 Year Old Boys Kids Birthday Gift",EditExclude listing,$11.89Fixed price,$0.00100% Free shipping,1,$11.89,–,"Nov 17, 2022"
45,", preview full size imageEducational Toys For 1 To 3 Year Old Toddlers  VTech Pull and Sing Puppy 🚛Fast Educational Toys For 1 To 3 Year Old Toddlers  VTech Pull and Sing Puppy 🚛Fast ",EditSell SimilarExclude listing,$27.89Fixed price,$20.0350% Free shipping,2,$55.78,–,"Nov 17, 2022"
46,", preview full size imageEducational Toy For Newborn Toddler Baby Boy Girl 3 6 9 12 18 Month 1 2 Year OldEducational Toy For Newborn Toddler Baby Boy Girl 3 6 9 12 18 Month 1 2 Year Old",EditExclude listing,$9.99Fixed price,$0.00100% Free shipping,1,$9.99,–,"Nov 16, 2022"
47,", preview full size imageBaby Toys Scooter Ride On Toys for Toddlers 1 Year Old Boy & Girl Craft GiftBaby Toys Scooter Ride On Toys for Toddlers 1 Year Old Boy & Girl Craft Gift",EditExclude listing,$56.99Fixed price,$0.00100% Free shipping,1,$56.99,–,"Nov 16, 2022"
48,", preview full size imageToys for 1 2 3 Year Old Boy, Baby Toys 6 to 12 Months Electric Train Toys forToys for 1 2 3 Year Old Boy, Baby Toys 6 to 12 Months Electric Train Toys for",EditExclude listing,$25.31Fixed price,$0.00100% Free shipping,8,$202.48,–,"Nov 16, 2022"
49,", preview full size imageToys For 1 Year Old Boy Girl Gifts 2 Educational Birthday Toddler Baby DrivingToys For 1 Year Old Boy Girl Gifts 2 Educational Birthday Toddler Baby Driving",EditExclude listing,$29.14Fixed price,$0.00100% Free shipping,6,$174.84,–,"Nov 16, 2022"
0,", preview full size imageAnimals Learning Book Educational Toys for Toddlers 2 3 4 5 Year Olds Kids BabyAnimals Learning Book Educational Toys for Toddlers 2 3 4 5 Year Olds Kids Baby",EditExclude listing,$32.41Fixed price,$0.00100% Free shipping,7,$226.85,–,"Nov 15, 2022"
1,", preview full size imageKids Bowling Set Toddler Toys for 1 2 3 4 5 Year Old Boys Girls Gifts Soft FoamKids Bowling Set Toddler Toys for 1 2 3 4 5 Year Old Boys Girls Gifts Soft Foam",EditExclude listing,$24.99Fixed price,$0.00100% Free shipping,1,$24.99,–,"Nov 15, 2022"
2,", preview full size image Educational Toy For 6 Months &1 2 3 Year Old Boy Girl Musical Mat For Toddler  Educational Toy For 6 Months &1 2 3 Year Old Boy Girl Musical Mat For Toddler ",EditExclude listing,$11.83Fixed price,$0.00100% Free shipping,5,$59.15,–,"Nov 15, 2022"
3,", preview full size imageBaby iPhone Toddler Educational Toys F 1 2 Year Old Tablet Learning Phone VoiceBaby iPhone Toddler Educational Toys F 1 2 Year Old Tablet Learning Phone Voice",EditExclude listing,$11.58Fixed price,$0.00100% Free shipping,4,$46.33,–,"Nov 15, 2022"
4,", preview full size image Educational Toy For 6 Months &1 2 3 Year Old Boy Girl Musical Mat For Toddler  Educational Toy For 6 Months &1 2 3 Year Old Boy Girl Musical Mat For Toddler ",EditExclude listing,$11.85Fixed price,$0.00100% Free shipping,22,$260.70,–,"Nov 15, 2022"
5,", preview full size imageMusical Learning Table Baby Toys for 1 2 3 Year Old Boys Girls Early EducationMusical Learning Table Baby Toys for 1 2 3 Year Old Boys Girls Early Education",EditExclude listing,$19.33Fixed price,$0.00100% Free shipping,2,$38.65,–,"Nov 14, 2022"
6,", preview full size imageEducational Toy For 6 Months And 1 2 3 Year Old Boy Girl Toddler Musical Mat NEWEducational Toy For 6 Months And 1 2 3 Year Old Boy Girl Toddler Musical Mat NEW",EditExclude listing,$20.76Fixed price,$0.00100% Free shipping,15,$311.33,–,"Nov 14, 2022"
7,", preview full size imageKids Rocking Pony Interactive Ride-On Horse Toddler Toy Gift for 1 2 3 Year OldsKids Rocking Pony Interactive Ride-On Horse Toddler Toy Gift for 1 2 3 Year Olds",EditExclude listing,$53.74Fixed price,$0.00100% Free shipping,1,$53.74,–,"Nov 14, 2022"
8,", preview full size imageBoy Baby Piano Light Up Animal Musical Toys Infant Kids Learning Toys 1 Year OldBoy Baby Piano Light Up Animal Musical Toys Infant Kids Learning Toys 1 Year Old",EditExclude listing,$13.99Fixed price,$0.00100% Free shipping,2,$27.98,–,"Nov 14, 2022"
9,", preview full size imageOuriky Busy Board Montessori Toys for 1 2 3 Year Old Toddler Toys(Small Board)Ouriky Busy Board Montessori Toys for 1 2 3 Year Old Toddler Toys(Small Board)",EditExclude listing,$27.01Fixed price,$0.00100% Free shipping,1,$27.01,–,"Nov 13, 2022"
10,", preview full size imageMontessori Toys for 2 1 3 4 Year Old Boy Gifts Wooden Jigsaw Puzzles for KidsMontessori Toys for 2 1 3 4 Year Old Boy Gifts Wooden Jigsaw Puzzles for Kids",EditExclude listing,$10.98Fixed price,$0.00100% Free shipping,4,$43.92,–,"Nov 13, 2022"
11,", preview full size imageTEMI Construction Toddler Truck Toys for 3 4 5 6 Year Old Boys - 5-In-1 FrictionTEMI Construction Toddler Truck Toys for 3 4 5 6 Year Old Boys - 5-In-1 Friction",EditExclude listing,$33.95Fixed price,$0.00100% Free shipping,4,$135.80,–,"Nov 13, 2022"
12,", preview full size imageBusy Cube for Kids Sensory Busy Board Travel Toy for Toddlers 1 2 3 Years OldBusy Cube for Kids Sensory Busy Board Travel Toy for Toddlers 1 2 3 Years Old",EditExclude listing,$24.99Fixed price,$0.00100% Free shipping,1,$24.99,–,"Nov 13, 2022"
13,", preview full size image1 Year Old Girl GiftsMontessori Toys for 1 2 3 Year Old BoysWooden Shape Sort...1 Year Old Girl GiftsMontessori Toys for 1 2 3 Year Old BoysWooden Shape Sort...",EditExclude listing,$43.62Fixed price,$0.00100% Free shipping,1,$43.62,–,"Nov 13, 2022"
14,", preview full size imageBaby Educational Soft Toys Newborns 0 3 7 9 Month Old Boy Girl Toddler Age 1 2 4Baby Educational Soft Toys Newborns 0 3 7 9 Month Old Boy Girl Toddler Age 1 2 4",EditExclude listing,$26.99Fixed price,$0.00100% Free shipping,2,$53.98,–,"Nov 13, 2022"
15,", preview full size imageFOPNETS Wooden Toys for 1 2 Year Old Boys Girls Activity Cube Gift Set LearningFOPNETS Wooden Toys for 1 2 Year Old Boys Girls Activity Cube Gift Set Learning",EditExclude listing,$69.99Fixed price,$0.00100% Free shipping,1,$69.99,–,"Nov 12, 2022"
16,", preview full size imageMontessori Toys for 1 Year Old Boy Gifts, Wooden Activity Cube Toys for 1Montessori Toys for 1 Year Old Boy Gifts, Wooden Activity Cube Toys for 1",EditExclude listing,$29.84Fixed price,$0.00100% Free shipping,1,$29.84,–,"Nov 12, 2022"
17,", preview full size imageEducational Toy For 6 Months And 1 2 3 Year Old Boy Girl Musical Mat US Ship NEWEducational Toy For 6 Months And 1 2 3 Year Old Boy Girl Musical Mat US Ship NEW",EditExclude listing,$16.03Fixed price,$0.00100% Free shipping,15,$240.48,–,"Nov 12, 2022"
18,", preview full size imageToy Cars for 1 Year Old Boy Gifts Baby Toys 12-18 Months, Musical Learning ToysToy Cars for 1 Year Old Boy Gifts Baby Toys 12-18 Months, Musical Learning Toys",EditExclude listing,$46.91Fixed price,$0.00100% Free shipping,2,$93.82,–,"Nov 12, 2022"
19,", preview full size imageEducational Learning Toys Age 6 Months 1 2 3 Years Old Baby Toddlers Boys GirlsEducational Learning Toys Age 6 Months 1 2 3 Years Old Baby Toddlers Boys Girls",EditExclude listing,$34.90Fixed price,$0.00100% Free shipping,2,$69.80,–,"Nov 12, 2022"
20,", preview full size imageToys for 6 Months 1 2 3 Years Old Baby Educational Learning  Toddlers Boys GirlsToys for 6 Months 1 2 3 Years Old Baby Educational Learning  Toddlers Boys Girls",EditSell SimilarExclude listing,$19.69Fixed price,$0.00100% Free shipping,1,$19.69,–,"Nov 12, 2022"
21,", preview full size imageMontessori Wooden Play Kit Kids Toy Box for 1+ Year Old Baby Gift Carrot HarvestMontessori Wooden Play Kit Kids Toy Box for 1+ Year Old Baby Gift Carrot Harvest",EditExclude listing,$15.50Fixed price,$16.200% Free shipping,2,$30.99,–,"Nov 11, 2022"
22,", preview full size imageEducational Learning Toys for Kids Toddlers Age 1 2 3 4 Years Old Girls BoysEducational Learning Toys for Kids Toddlers Age 1 2 3 4 Years Old Girls Boys",EditExclude listing,$21.11Fixed price,$0.00100% Free shipping,2,$42.22,–,"Nov 11, 2022"
23,", preview full size imagePRAGYM Montessori & Toddler Toys for 1 Year Old Boy/Girl, Baby 12-18... PRAGYM Montessori & Toddler Toys for 1 Year Old Boy/Girl, Baby 12-18... ",EditExclude listing,$11.42Fixed price,$0.00100% Free shipping,1,$11.42,–,"Nov 11, 2022"
24,", preview full size image8 Pcs Stacking Rings Soft Toys for Babies 0 3 4 5 6 12 18 Months 1 Year Old Girl8 Pcs Stacking Rings Soft Toys for Babies 0 3 4 5 6 12 18 Months 1 Year Old Girl",EditExclude listing,$25.46Fixed price,$0.00100% Free shipping,6,$152.75,–,"Nov 11, 2022"
25,", preview full size imageMushroom Picking Toy Wooden Montessori Colorful Toys for Baby 1-5 Year OldMushroom Picking Toy Wooden Montessori Colorful Toys for Baby 1-5 Year Old",EditExclude listing,$9.00Fixed price,$6.750% Free shipping,1,$9.00,–,"Nov 10, 2022"
26,", preview full size imageTOYVENTIVE Wooden Baby Activity Cube Boys Gift Set 1, 2 Year Old Blue PackagingTOYVENTIVE Wooden Baby Activity Cube Boys Gift Set 1, 2 Year Old Blue Packaging",EditExclude listing,$37.98Fixed price,$0.00100% Free shipping,1,$37.98,–,"Nov 10, 2022"
27,", preview full size image Ride On Toys For 1 2 3 Year Old Toddlers Interactive Boys Girls Learning Kids Ride On Toys For 1 2 3 Year Old Toddlers Interactive Boys Girls Learning Kids",EditExclude listing,$67.99Fixed price,$0.00100% Free shipping,1,$67.99,–,"Nov 10, 2022"
28,", preview full size imageEducational Toy For 6 Months And 1 2 3 Year Old Boy Girl Toddler Musical Mat NEWEducational Toy For 6 Months And 1 2 3 Year Old Boy Girl Toddler Musical Mat NEW",EditExclude listing,$15.57Fixed price,$0.00100% Free shipping,2,$31.13,–,"Nov 10, 2022"
29,", preview full size image3x Insect Suction Cup Spinner Toys Spinning Top Baby Bath Toys for 1 2 Year Old 3x Insect Suction Cup Spinner Toys Spinning Top Baby Bath Toys for 1 2 Year Old ",EditExclude listing,$13.30Fixed price,$0.00100% Free shipping,9,$119.72,–,"Nov 10, 2022"
30,", preview full size imageKids Boy Girl Educational Toys For 1-6 Year Old Toddlers Baby Learning Tablet USKids Boy Girl Educational Toys For 1-6 Year Old Toddlers Baby Learning Tablet US",EditExclude listing,$11.36Fixed price,$0.00100% Free shipping,36,$409.10,–,"Nov 9, 2022"
31,", preview full size imageKids Toys for 3 2 1 Year Old Girls Toys Age 3 2 1Magna Doodle Drawing Board GiftKids Toys for 3 2 1 Year Old Girls Toys Age 3 2 1Magna Doodle Drawing Board Gift",EditExclude listing,$10.43Fixed price,$0.00100% Free shipping,22,$229.42,–,"Nov 9, 2022"
32,", preview full size imageBalance Bike for 1 Year Old, Pre-School 4 Wheels Bike, Designed for ToddlersBalance Bike for 1 Year Old, Pre-School 4 Wheels Bike, Designed for Toddlers",EditExclude listing,$35.00Fixed price,$0.00100% Free shipping,1,$35.00,–,"Nov 9, 2022"
33,", preview full size imageiHaHa Toy Trucks Car for 1 2 3 4 5 Year Old Toddlers Boys, 5 in 1 Carrier Truck iHaHa Toy Trucks Car for 1 2 3 4 5 Year Old Toddlers Boys, 5 in 1 Carrier Truck ",EditExclude listing,$35.91Fixed price,$0.00100% Free shipping,1,$35.91,–,"Nov 9, 2022"
34,", preview full size imageNew Educational Learning Toys for 6 Months 1 2 3 Years Old Babies Toddlers KidsNew Educational Learning Toys for 6 Months 1 2 3 Years Old Babies Toddlers Kids",EditExclude listing,$18.15Fixed price,$0.00100% Free shipping,2,$36.30,–,"Nov 9, 2022"
35,", preview full size imageToddler Busy Board Bear for 1 2 3 Year Old - Wooden Handmade Baby Sensory BoardsToddler Busy Board Bear for 1 2 3 Year Old - Wooden Handmade Baby Sensory Boards",EditExclude listing,$50.00Fixed price,$14.990% Free shipping,1,$50.00,–,"Nov 9, 2022"
36,", preview full size imageSTEM Toy Building Toy for Age 6 7 8 9 10 11 12 Years Old Boys Girls - 2-in-1 ...STEM Toy Building Toy for Age 6 7 8 9 10 11 12 Years Old Boys Girls - 2-in-1 ...",EditExclude listing,$28.81Fixed price,$0.00100% Free shipping,1,$28.81,–,"Nov 9, 2022"
37,", preview full size imageEducational Toy Baby Tablet For 1-6 year old Boy Girl Learning Creative Toy GiftEducational Toy Baby Tablet For 1-6 year old Boy Girl Learning Creative Toy Gift",EditExclude listing,$5.63Fixed price,$0.00100% Free shipping,3,$16.89,–,"Nov 8, 2022"
38,", preview full size imageWooden Montessori Toys for 1 2 3 Year Old Baby Girls Boys, Wood Shape Sorter Wooden Montessori Toys for 1 2 3 Year Old Baby Girls Boys, Wood Shape Sorter ",EditExclude listing,$32.89Fixed price,$0.00100% Free shipping,2,$65.77,–,"Nov 8, 2022"
39,", preview full size imageBaby Balance Bike for 1-2 Year Old Boy Girl Toddler Mini Bike Christmas GiftBaby Balance Bike for 1-2 Year Old Boy Girl Toddler Mini Bike Christmas Gift",EditSell SimilarExclude listing,$74.67Fixed price,$0.00100% Free shipping,1,$74.67,–,"Nov 8, 2022"
40,", preview full size imageOuriky Busy Board Montessori Toys for 1 2 3 Year Old Toddler Toys, WoodenOuriky Busy Board Montessori Toys for 1 2 3 Year Old Toddler Toys, Wooden",EditExclude listing,$31.52Fixed price,$0.00100% Free shipping,1,$31.52,–,"Nov 8, 2022"
41,", preview full size imageLearning Baby Toy for Toddlers 1 2 3 4 5 6 7 Year Old Boys Girls Early EducationLearning Baby Toy for Toddlers 1 2 3 4 5 6 7 Year Old Boys Girls Early Education",EditExclude listing,$16.95Fixed price,$0.00100% Free shipping,1,$16.95,–,"Nov 8, 2022"
42,", preview full size imageWooden Sorting Stacking Toys for Toddlers 1-3 Years Old Shape Sorter Color Re...Wooden Sorting Stacking Toys for Toddlers 1-3 Years Old Shape Sorter Color Re...",EditExclude listing,$19.40Fixed price,$0.00100% Free shipping,1,$19.40,–,"Nov 8, 2022"
43,", preview full size imageGirls First Birthday Gift Age 1 Toddler Toy For 2 Year Old Baby Present MusicGirls First Birthday Gift Age 1 Toddler Toy For 2 Year Old Baby Present Music",EditExclude listing,$27.84Fixed price,$0.00100% Free shipping,1,$27.84,–,"Nov 8, 2022"
44,", preview full size imageLOL-FUN Baby Balance Bike for 1 Year Old Boy or Girl - Black - Torn Box - NEWLOL-FUN Baby Balance Bike for 1 Year Old Boy or Girl - Black - Torn Box - NEW",EditExclude listing,$47.66Fixed price,$0.00100% Free shipping,1,$47.66,–,"Nov 8, 2022"
45,", preview full size imageConstruction Truck Toys for 3 4 5 6 Year Old Boys, 5-In-1 Friction Power Toy VehConstruction Truck Toys for 3 4 5 6 Year Old Boys, 5-In-1 Friction Power Toy Veh",EditExclude listing,$39.99Fixed price,$0.00100% Free shipping,1,$39.99,–,"Nov 8, 2022"
46,", preview full size imageToddlers Toys for 1 2 3 Years Old Kids Pound A Ball Toys Included 2 Hammer & ...Toddlers Toys for 1 2 3 Years Old Kids Pound A Ball Toys Included 2 Hammer & ...",EditExclude listing,$35.37Fixed price,$0.00100% Free shipping,1,$35.37,–,"Nov 7, 2022"
47,", preview full size imageUNIH Musical Baby Toys for 1 Year Old Boy Girl, Infant Crawling Toys Dinosaur CaUNIH Musical Baby Toys for 1 Year Old Boy Girl, Infant Crawling Toys Dinosaur Ca",EditExclude listing,$23.99Fixed price,$0.00100% Free shipping,1,$23.99,–,"Nov 7, 2022"
48,", preview full size imageBest Toys For 18 Months Old Age 1 To 4 Years Toddler Musical Games Girl Boy GiftBest Toys For 18 Months Old Age 1 To 4 Years Toddler Musical Games Girl Boy Gift",EditExclude listing,$39.22Fixed price,$0.00100% Free shipping,1,$39.22,–,"Nov 7, 2022"
49,", preview full size imageWooden Montessori Object Permanence Box for Babies 1 Year Old Xmas GiftsWooden Montessori Object Permanence Box for Babies 1 Year Old Xmas Gifts",EditExclude listing,$14.87Fixed price,$0.00100% Free shipping,2,$29.74,–,"Nov 7, 2022"
0,", preview full size imageToddler Carrier Truck Transport Vehicles Toys-5 in 1 Toys for 3-7 Year Old BoysToddler Carrier Truck Transport Vehicles Toys-5 in 1 Toys for 3-7 Year Old Boys",EditSell SimilarExclude listing,$15.99Fixed price,$0.00100% Free shipping,3,$47.97,–,"Nov 7, 2022"
1,", preview full size imageKids Flashlights Toys for 1 Year Old Boys & Girls, Baby Projector Toys with MusiKids Flashlights Toys for 1 Year Old Boys & Girls, Baby Projector Toys with Musi",EditExclude listing,$24.08Fixed price,$0.00100% Free shipping,1,$24.08,–,"Nov 7, 2022"
2,", preview full size imageToddler Toys Car for Boys: Kids Toys for 1 2 3 4 5 Year Old Boys Girls | BoyToddler Toys Car for Boys: Kids Toys for 1 2 3 4 5 Year Old Boys Girls | Boy",EditExclude listing,$31.66Fixed price,$0.00100% Free shipping,1,$31.66,–,"Nov 6, 2022"
3,", preview full size imageHahaland Toys for 1 Year Old Boy Gifts Girl Toy Multifunctional Music Light W...Hahaland Toys for 1 Year Old Boy Gifts Girl Toy Multifunctional Music Light W...",EditExclude listing,$60.13Fixed price,$0.00100% Free shipping,1,$60.13,–,"Nov 6, 2022"
4,", preview full size imageToy Cars for 1 2 3 Year Old Boy Girls Gifts Fire Truck with Music & Light Toy...Toy Cars for 1 2 3 Year Old Boy Girls Gifts Fire Truck with Music & Light Toy...",EditExclude listing,$38.45Fixed price,$0.00100% Free shipping,1,$38.45,–,"Nov 6, 2022"
5,", preview full size imageConstruction Truck Toys For 1 2 3 4 5 6 Year Old Boys 5-in-1 Friction Power ToyConstruction Truck Toys For 1 2 3 4 5 6 Year Old Boys 5-in-1 Friction Power Toy",EditExclude listing,$38.51Fixed price,$0.00100% Free shipping,1,$38.51,–,"Nov 6, 2022"
6,", preview full size imageHekaty Shape Sorter Montessori Toys for 1 2 3 Year Old Boy Girl Baby Toy 12-1...Hekaty Shape Sorter Montessori Toys for 1 2 3 Year Old Boy Girl Baby Toy 12-1...",EditExclude listing,$18.41Fixed price,$0.00100% Free shipping,1,$18.41,–,"Nov 6, 2022"
7,", preview full size imageKids Boy Girl Educational Toys For 1-6 Year Old Toddlers Baby Learning Tablet USKids Boy Girl Educational Toys For 1-6 Year Old Toddlers Baby Learning Tablet US",EditExclude listing,$8.38Fixed price,$0.00100% Free shipping,70,$586.51,–,"Nov 6, 2022"
8,", preview full size image""First Birthday Toddler Piano Toys for 1 Year Old Girls Baby Musical Key""""First Birthday Toddler Piano Toys for 1 Year Old Girls Baby Musical Key""",EditExclude listing,$31.34Fixed price,$0.00100% Free shipping,1,$31.34,–,"Nov 5, 2022"
9,", preview full size imageBaby Toys 12-18 Months Musical Train Kids Toys for 1 2 3 4+ Year Old Boys Girls Baby Toys 12-18 Months Musical Train Kids Toys for 1 2 3 4+ Year Old Boys Girls ",EditExclude listing,$43.77Fixed price,$0.00100% Free shipping,1,$43.77,–,"Nov 5, 2022"
10,", preview full size imageEducational Learning Toys for 6 Months 1 2 3 Years Old Baby Toddlers Boys Girls Educational Learning Toys for 6 Months 1 2 3 Years Old Baby Toddlers Boys Girls ",EditExclude listing,$15.98Fixed price,$0.00100% Free shipping,2,$31.96,–,"Nov 4, 2022"
11,", preview full size imageSymdiro Montessori Toys for 1 2 3 Year Old Boys Girls Wooden Sorting & StackingSymdiro Montessori Toys for 1 2 3 Year Old Boys Girls Wooden Sorting & Stacking",EditExclude listing,$22.31Fixed price,$0.00100% Free shipping,2,$44.62,–,"Nov 4, 2022"
12,", preview full size imageToys for 1-10 Year Old Girls,Star Projector for Kids 2-9 Year Old Girl Gifts forToys for 1-10 Year Old Girls,Star Projector for Kids 2-9 Year Old Girl Gifts for",EditExclude listing,$21.20Fixed price,$0.00100% Free shipping,1,$21.20,–,"Nov 4, 2022"
13,", preview full size imageToddler Toys Car for Kids Toys for 1 2 3 4 Year Old Boys 5 in 1 Carrier TrucksToddler Toys Car for Kids Toys for 1 2 3 4 Year Old Boys 5 in 1 Carrier Trucks",EditExclude listing,$40.80Fixed price,$0.00100% Free shipping,1,$40.80,–,"Nov 3, 2022"
14,", preview full size imageStocking Stuffers For Toddlers Kids 1 2 3 Years Old Girls Boys Wooden PuzzlesStocking Stuffers For Toddlers Kids 1 2 3 Years Old Girls Boys Wooden Puzzles",EditExclude listing,$24.86Fixed price,$0.00100% Free shipping,1,$24.86,–,"Nov 3, 2022"
15,", preview full size image1 Year Old Boy Gifts - Activity Robot Baby Toys 12-18 Months - Musical Light ...1 Year Old Boy Gifts - Activity Robot Baby Toys 12-18 Months - Musical Light ...",EditExclude listing,$27.18Fixed price,$0.00100% Free shipping,1,$27.18,–,"Nov 3, 2022"
16,", preview full size imageBath Toys for Toddlers Kids Babies 1 2 3 Year Old Boys Girls Bathtub ToysBath Toys for Toddlers Kids Babies 1 2 3 Year Old Boys Girls Bathtub Toys",EditExclude listing,$17.09Fixed price,$0.00100% Free shipping,1,$17.09,–,"Nov 3, 2022"
17,", preview full size imageCars Toys for 1 2 3 Year Old Boys and Girls Push and Go Friction PoweredCars Toys for 1 2 3 Year Old Boys and Girls Push and Go Friction Powered",EditExclude listing,$21.59Fixed price,$0.00100% Free shipping,1,$21.59,–,"Nov 3, 2022"
18,", preview full size imageToys 1 Years Old Boy Girl Baby 6 -12 Months Music Light Up Crab Christmas GiftsToys 1 Years Old Boy Girl Baby 6 -12 Months Music Light Up Crab Christmas Gifts",EditExclude listing,$23.99Fixed price,$4.110% Free shipping,1,$23.99,–,"Nov 3, 2022"
19,", preview full size imageBaby Toys Music Hammer Rattle 12-18 Months 1 Year Old Toddler Boys Girls Lights Baby Toys Music Hammer Rattle 12-18 Months 1 Year Old Toddler Boys Girls Lights ",EditExclude listing,$11.98Fixed price,$6.750% Free shipping,1,$11.98,–,"Nov 2, 2022"
20,", preview full size imageBaby Toys 6 to 12 Months,Dancing Penguin Infant Crawling Toys for 1 Year Old BoyBaby Toys 6 to 12 Months,Dancing Penguin Infant Crawling Toys for 1 Year Old Boy",EditExclude listing,$38.95Fixed price,$0.00100% Free shipping,1,$38.95,–,"Nov 2, 2022"
21,", preview full size imageEducational Toys Sing Puppy For 1 to 3 Year Old Toddlers Baby Gift for Girl BoyEducational Toys Sing Puppy For 1 to 3 Year Old Toddlers Baby Gift for Girl Boy",EditExclude listing,$39.99Fixed price,$0.00100% Free shipping,1,$39.99,–,"Nov 2, 2022"
22,", preview full size imageVTech, Count and Chomp Dino, Dinosaur Learning Toy for 1 Year OldsVTech, Count and Chomp Dino, Dinosaur Learning Toy for 1 Year Olds",EditExclude listing,$33.15Fixed price,$0.00100% Free shipping,2,$66.30,–,"Nov 2, 2022"
23,", preview full size imageEducational Play Set for Kids Age 1, 2, 3 - Push & Pull Cars for Two Year Old...Educational Play Set for Kids Age 1, 2, 3 - Push & Pull Cars for Two Year Old...",EditExclude listing,$16.21Fixed price,$3.990% Free shipping,1,$16.21,–,"Nov 1, 2022"
24,", preview full size imageTOYOKID Baby Bath Toys for Toddlers 1 2 3 4 5 Years Old Boys and Girls Kid,LightTOYOKID Baby Bath Toys for Toddlers 1 2 3 4 5 Years Old Boys and Girls Kid,Light",EditExclude listing,$17.09Fixed price,$0.00100% Free shipping,1,$17.09,–,"Nov 1, 2022"
