,Listing,Actions,Avg Sold Price,Avg Shipping,Total Sold,Item_Sale,Bids,Date Last Sold
12,", preview full size image1 Year Old Boy Birthday Gift - Baby Toddler Toys for Boy Gifts Pop up Toy with 1 Year Old Boy Birthday Gift - Baby Toddler Toys for Boy Gifts Pop up Toy with ",EditExclude listing,$38.28Fixed price,$0.00100% Free shipping,1,$38.28,–,"Nov 30, 2023"
13,", preview full size imageKids Toys Car for Boys Boy Toy Trucks for 1 2 3 4 5 6 Year Old Boys Girls | 5...Kids Toys Car for Boys Boy Toy Trucks for 1 2 3 4 5 6 Year Old Boys Girls | 5...",EditSell SimilarExclude listing,$35.04Fixed price,$0.00100% Free shipping,1,$35.04,–,"Nov 30, 2023"
14,", preview full size imageToys for 1 Year Old Girl Gifts,2 in 1 Piano Mat Montessori Toys for 1 2 Year OldToys for 1 Year Old Girl Gifts,2 in 1 Piano Mat Montessori Toys for 1 2 Year Old",EditSell SimilarExclude listing,$29.07Fixed price,$0.00100% Free shipping,1,$29.07,–,"Nov 30, 2023"
15,", preview full size imageMini Wooden Toys Education For 1 2 3 4 5 Years Old Lead-free Boys Girls ToddlerMini Wooden Toys Education For 1 2 3 4 5 Years Old Lead-free Boys Girls Toddler",EditSell SimilarExclude listing,$11.58Fixed price,$0.00100% Free shipping,2,$23.16,–,"Nov 30, 2023"
16,", preview full size image Toys for 1 Year Old Boy, Baby Boy Toys 6 to 12 Months 12-18 Months, Soft Car Toys for 1 Year Old Boy, Baby Boy Toys 6 to 12 Months 12-18 Months, Soft Car",EditExclude listing,$34.92Fixed price,$0.00100% Free shipping,1,$34.92,–,"Nov 30, 2023"
17,", preview full size imageKids Toys Car for Boys: Boy Toy Trucks for 1 2 3 4 5 6 Year Old Boys Girls | TodKids Toys Car for Boys: Boy Toy Trucks for 1 2 3 4 5 6 Year Old Boys Girls | Tod",EditSell SimilarExclude listing,$29.20Fixed price,$0.00100% Free shipping,11,$321.21,–,"Nov 30, 2023"
18,", preview full size imageMontessori Toys for 1 2 3 Year Old Boys Girls, Toddler Toys Wooden Puzzles for 1Montessori Toys for 1 2 3 Year Old Boys Girls, Toddler Toys Wooden Puzzles for 1",EditSell SimilarExclude listing,$19.67Fixed price,$0.00100% Free shipping,1,$19.67,–,"Nov 30, 2023"
19,", preview full size imageBaby Toys 12-18 Months Dancing Cat Toys for 1 Year Old Boys Girls with Music & 1Baby Toys 12-18 Months Dancing Cat Toys for 1 Year Old Boys Girls with Music & 1",EditSell SimilarExclude listing,$57.17Fixed price,$0.00100% Free shipping,1,$57.17,–,"Nov 30, 2023"
20,", preview full size imageEducational Learning Musical Toy for Baby Toddler Kid 1 2 3 4 Year Old Boy GirlsEducational Learning Musical Toy for Baby Toddler Kid 1 2 3 4 Year Old Boy Girls",EditSell SimilarExclude listing,$20.35Fixed price,$0.00100% Free shipping,14,$284.96,–,"Nov 30, 2023"
21,", preview full size image Farm Animals Big Barn Toys for 1 2 3 Year Old, Toddler Montessori Learning  Farm Animals Big Barn Toys for 1 2 3 Year Old, Toddler Montessori Learning ",EditExclude listing,$33.47Fixed price,$0.00100% Free shipping,2,$66.94,–,"Nov 30, 2023"
22,", preview full size image Montessori Toys for 1 2 3 Year Old Boys Girls-Wooden Sorting & Stacking Toys A Montessori Toys for 1 2 3 Year Old Boys Girls-Wooden Sorting & Stacking Toys A",EditExclude listing,$25.31Fixed price,$0.00100% Free shipping,1,$25.31,–,"Nov 30, 2023"
23,", preview full size imageMusical Light Up Baby Interactive Toddler Toy For 6-12 Month Age 1 Year Old GirlMusical Light Up Baby Interactive Toddler Toy For 6-12 Month Age 1 Year Old Girl",EditSell SimilarExclude listing,$25.68Fixed price,$0.00100% Free shipping,1,$25.68,–,"Nov 29, 2023"
24,", preview full size imagePink Piano Toys for 1+Year Old Girls First Birthday Gifts Toddler Piano Music ToPink Piano Toys for 1+Year Old Girls First Birthday Gifts Toddler Piano Music To",EditSell SimilarExclude listing,$33.99Fixed price,$0.00100% Free shipping,1,$33.99,–,"Nov 29, 2023"
25,", preview full size image 9 PCS Soft Car Toys with Playmat/Storage Bag|1 2 Year Old Boy City Map 9 PCS Soft Car Toys with Playmat/Storage Bag|1 2 Year Old Boy City Map",EditExclude listing,$33.75Fixed price,$0.00100% Free shipping,1,$33.75,–,"Nov 29, 2023"
26,", preview full size imageCar Ramp Toys for Toddlers 1 2 3 Year Old Boy, Race Track Car ToyCar Ramp Toys for Toddlers 1 2 3 Year Old Boy, Race Track Car Toy",EditSell SimilarExclude listing,$12.99Fixed price,$0.00100% Free shipping,2,$25.98,–,"Nov 29, 2023"
27,", preview full size imageBABLOCVID Toddler Toys,Toys for 1-2 Year Old Girls,Magnetic one size, Pink BABLOCVID Toddler Toys,Toys for 1-2 Year Old Girls,Magnetic one size, Pink ",EditExclude listing,$43.89Fixed price,$13.880% Free shipping,1,$43.89,–,"Nov 29, 2023"
28,", preview full size imageBaby Montessori Toys - Toddler Busy Board Infant Sensory Toys for 1 + Year Old Baby Montessori Toys - Toddler Busy Board Infant Sensory Toys for 1 + Year Old ",EditSell SimilarExclude listing,$17.90Fixed price,$0.00100% Free shipping,1,$17.90,–,"Nov 29, 2023"
29,", preview full size imageNew Educational Toys For 1-6 Year Olds Interactive Kids Learning Tablet ToddlersNew Educational Toys For 1-6 Year Olds Interactive Kids Learning Tablet Toddlers",EditSell SimilarExclude listing,$5.90Fixed price,$20.000% Free shipping,10,$59.00,–,"Nov 29, 2023"
30,", preview full size imageBaby Phone Toy Toddler Educational 1-8 Year Old w/ Music & LED Light 8 FunctionsBaby Phone Toy Toddler Educational 1-8 Year Old w/ Music & LED Light 8 Functions",EditSell SimilarExclude listing,$13.75Fixed price,$0.00100% Free shipping,1,$13.75,–,"Nov 29, 2023"
31,", preview full size image Toys for 1 2 3 Year Old Girl, 7 in 1 Toddler Girl Toys with Cute Crown, 1 2 3 Y Toys for 1 2 3 Year Old Girl, 7 in 1 Toddler Girl Toys with Cute Crown, 1 2 3 Y",EditExclude listing,$23.24Fixed price,$0.00100% Free shipping,1,$23.24,–,"Nov 29, 2023"
32,", preview full size imageToys For 1 Year Old Boy Girl Gifts Educational Birthday Toddler Baby Driving NewToys For 1 Year Old Boy Girl Gifts Educational Birthday Toddler Baby Driving New",EditExclude listing,$15.99Fixed price,$0.00100% Free shipping,3,$47.97,–,"Nov 29, 2023"
33,Item ID 384449130265,EditExclude listing,$5.58Fixed price,$3.990% Free shipping,2,$11.16,–,"Nov 29, 2023"
34,", preview full size imageToys For 1 Year Old Boy Girl Gifts Educational Birthday Toddler Baby Driving NewToys For 1 Year Old Boy Girl Gifts Educational Birthday Toddler Baby Driving New",EditSell SimilarExclude listing,$16.37Fixed price,$0.00100% Free shipping,2,$32.74,–,"Nov 29, 2023"
35,", preview full size imageToys for 1 2 3 Year Old Girl Gifts,10IN LCD Writing Tablet for Kids (Pink)Toys for 1 2 3 Year Old Girl Gifts,10IN LCD Writing Tablet for Kids (Pink)",EditExclude listing,$14.99Fixed price,$0.00100% Free shipping,2,$29.98,–,"Nov 28, 2023"
36,", preview full size imageHooku Montessori Toys for 1 Year Old, Sensory Toys for Babies, Food Grade PullHooku Montessori Toys for 1 Year Old, Sensory Toys for Babies, Food Grade Pull",EditSell SimilarExclude listing,$17.07Fixed price,$0.00100% Free shipping,3,$51.20,–,"Nov 28, 2023"
37,", preview full size imagePiano Toys for 1 2 Years Old Boy Toddler First Birthday Gifts for One Year OldPiano Toys for 1 2 Years Old Boy Toddler First Birthday Gifts for One Year Old",EditSell SimilarExclude listing,$31.47Fixed price,$0.00100% Free shipping,5,$157.37,–,"Nov 28, 2023"
38,", preview full size image9 Pcs Soft Car Toys for 1 Year Old Boy and Girl, First One Year Old Boy Birthday9 Pcs Soft Car Toys for 1 Year Old Boy and Girl, First One Year Old Boy Birthday",EditExclude listing,$23.49Fixed price,$0.00100% Free shipping,1,$23.49,–,"Nov 28, 2023"
39,", preview full size imageEducational Learning Kids Tablet 1-7 Year Old Toddlers Gift for Girls Children'sEducational Learning Kids Tablet 1-7 Year Old Toddlers Gift for Girls Children's",EditSell SimilarExclude listing,$15.00Fixed price,$0.00100% Free shipping,3,$45.00,–,"Nov 28, 2023"
40,", preview full size imageTalking Flash Cards Learning Toys for Boys Girls Toddlers Toy 1 2 3 4 5 Year OldTalking Flash Cards Learning Toys for Boys Girls Toddlers Toy 1 2 3 4 5 Year Old",EditExclude listing,$8.69Fixed price,$0.00100% Free shipping,3,$26.07,–,"Nov 28, 2023"
41,", preview full size imageSoft Car Toys for 1 Year Old Boy Girl - Baby Toys 6 to 12 Months 12-18 Months Soft Car Toys for 1 Year Old Boy Girl - Baby Toys 6 to 12 Months 12-18 Months ",EditExclude listing,$33.65Fixed price,$28.020% Free shipping,1,$33.65,–,"Nov 28, 2023"
42,", preview full size image5 in 1 - Toddler Fire Truck Carrier Toys for 3 4 5 6 Years Old Boys Girls - Geft5 in 1 - Toddler Fire Truck Carrier Toys for 3 4 5 6 Years Old Boys Girls - Geft",EditExclude listing,$46.98Fixed price,$0.00100% Free shipping,1,$46.98,–,"Nov 28, 2023"
43,", preview full size imageConstruction Toddler Truck Toys for 3 4 5 6 Year Old Boys - 5-In-1 Friction P...Construction Toddler Truck Toys for 3 4 5 6 Year Old Boys - 5-In-1 Friction P...",EditExclude listing,$34.99Fixed price,$0.00100% Free shipping,1,$34.99,–,"Nov 28, 2023"
44,", preview full size image Montessori Toys for 1+ Year Old Girl Gifts, Baby Toys 12-18 Months Wooden  Montessori Toys for 1+ Year Old Girl Gifts, Baby Toys 12-18 Months Wooden ",EditExclude listing,$17.32Fixed price,$0.00100% Free shipping,1,$17.32,–,"Nov 28, 2023"
45,", preview full size imageMontessori Toys for 1 2 3 Year Old Boys Girls, Sensory Toys for Toddlers 1-3, WoMontessori Toys for 1 2 3 Year Old Boys Girls, Sensory Toys for Toddlers 1-3, Wo",EditSell SimilarExclude listing,$11.99Fixed price,$0.00100% Free shipping,1,$11.99,–,"Nov 28, 2023"
46,", preview full size imageBaby Toys 12-18 Months Musical Bus Toys for 1 2 3 4+Year Old Boys Girls BirthdayBaby Toys 12-18 Months Musical Bus Toys for 1 2 3 4+Year Old Boys Girls Birthday",EditExclude listing,$29.00Fixed price,$0.00100% Free shipping,1,$29.00,–,"Nov 27, 2023"
47,", preview full size imageEducational Toys Baby Tablet For 1-6 year old Boy Girl Learning & Playing Gift..Educational Toys Baby Tablet For 1-6 year old Boy Girl Learning & Playing Gift..",EditSell SimilarExclude listing,$4.99Fixed price,$1.990% Free shipping,2,$9.98,–,"Nov 27, 2023"
48,", preview full size imageWooden Activity Cube, Montessori Toys for 1+ Year Old Boy, Multipurpose EducatioWooden Activity Cube, Montessori Toys for 1+ Year Old Boy, Multipurpose Educatio",EditSell SimilarExclude listing,$42.26Fixed price,$0.00100% Free shipping,1,$42.26,–,"Nov 27, 2023"
49,", preview full size imageEducational Baby Learning Tablet Toys for Girls Boys Kids Age 1-6 Years Old GiftEducational Baby Learning Tablet Toys for Girls Boys Kids Age 1-6 Years Old Gift",EditSell SimilarExclude listing,$10.08Fixed price,$0.00100% Free shipping,25,$251.98,–,"Nov 27, 2023"
0,", preview full size imageMatesy Toddler Toys for 1-2 Year Old Girls Gifts, Magnetic Drawing Board for KidMatesy Toddler Toys for 1-2 Year Old Girls Gifts, Magnetic Drawing Board for Kid",EditExclude listing,$15.00Fixed price,$0.00100% Free shipping,1,$15.00,–,"Nov 27, 2023"
1,", preview full size imageToddler Fire Toys for 3 4 5 6 Years Old Boys Girls - 5 in 1 Carrier Truck TranspToddler Fire Toys for 3 4 5 6 Years Old Boys Girls - 5 in 1 Carrier Truck Transp",EditExclude listing,$32.62Fixed price,$0.00100% Free shipping,2,$65.23,–,"Nov 27, 2023"
2,", preview full size imageToddlers Busy Board Montessori Toys for 1 2 3 4 Year Old Boy Girl Gifts Green Toddlers Busy Board Montessori Toys for 1 2 3 4 Year Old Boy Girl Gifts Green ",EditExclude listing,$37.74Fixed price,$0.00100% Free shipping,4,$150.96,–,"Nov 27, 2023"
3,", preview full size imageALASOU 9 PCS Soft Car Toys for 1 Year Old Boy and Girl|First One Year Old BoyALASOU 9 PCS Soft Car Toys for 1 Year Old Boy and Girl|First One Year Old Boy",EditExclude listing,$29.82Fixed price,$0.00100% Free shipping,1,$29.82,–,"Nov 27, 2023"
4,", preview full size imageToys For 1 Year Old Boy Birthday Activity Robot Baby Toys For 1 Year Old MusicalToys For 1 Year Old Boy Birthday Activity Robot Baby Toys For 1 Year Old Musical",EditSell SimilarExclude listing,$18.05Fixed price,$0.00100% Free shipping,18,$324.92,–,"Nov 27, 2023"
5,", preview full size imageBaby Toys 6-12 Months+ Dancing Music Light for 1 Year Old Girl Boy, 9 6... Baby Toys 6-12 Months+ Dancing Music Light for 1 Year Old Girl Boy, 9 6... ",EditExclude listing,$34.79Fixed price,$0.00100% Free shipping,1,$34.79,–,"Nov 27, 2023"
6,", preview full size imageToddler Tool Set Age 1-2, Toys for 1 Year Old Boy Gifts, Baby Workbench with...Toddler Tool Set Age 1-2, Toys for 1 Year Old Boy Gifts, Baby Workbench with...",EditExclude listing,$16.99Fixed price,$0.00100% Free shipping,1,$16.99,–,"Nov 27, 2023"
7,", preview full size imageToys for 1-10 Year Old Girls,Star Projector for Kids 2-9 Year Old Girl Gifts ToyToys for 1-10 Year Old Girls,Star Projector for Kids 2-9 Year Old Girl Gifts Toy",EditSell SimilarExclude listing,$15.99Fixed price,$0.00100% Free shipping,1,$15.99,–,"Nov 27, 2023"
8,", preview full size imageCar Toys for 1 2 3 Year Old Boy, Educational Toddler Toys Age 1-2 - Push and GoCar Toys for 1 2 3 Year Old Boy, Educational Toddler Toys Age 1-2 - Push and Go",EditSell SimilarExclude listing,$14.70Fixed price,$0.00100% Free shipping,3,$44.10,–,"Nov 27, 2023"
9,", preview full size imageCar Ramp Toys for Toddlers 1 2 3 Year Old Boy, Race Track Car ToyCar Ramp Toys for Toddlers 1 2 3 Year Old Boy, Race Track Car Toy",EditSell SimilarExclude listing,$13.91Fixed price,$0.00100% Free shipping,1,$13.91,–,"Nov 27, 2023"
10,", preview full size imageToys for 1 Year Old Girl Gifts, 2 in 1 Musical Piano&Drum Mat, Baby Infant PinkToys for 1 Year Old Girl Gifts, 2 in 1 Musical Piano&Drum Mat, Baby Infant Pink",EditSell SimilarExclude listing,$23.02Fixed price,$0.00100% Free shipping,5,$115.09,–,"Nov 27, 2023"
11,", preview full size image4 in 1 Montessori Toys for 6+ Month Old Baby Stacking, Sensory, Pull String Toys4 in 1 Montessori Toys for 6+ Month Old Baby Stacking, Sensory, Pull String Toys",EditSell SimilarExclude listing,$39.00Fixed price,$0.00100% Free shipping,1,$39.00,–,"Nov 27, 2023"
12,", preview full size imageKids Rolling Pony Toddler Ride-on Horse Activity Toy Gift for 1 2 3 Year OldsKids Rolling Pony Toddler Ride-on Horse Activity Toy Gift for 1 2 3 Year Olds",EditExclude listing,$37.25Fixed price,$0.00100% Free shipping,6,$223.48,–,"Nov 26, 2023"
13,", preview full size imageEducational Learning Toys for Kids Toddlers Age 2 3 4 5 6 7 Years Old Boys GirlsEducational Learning Toys for Kids Toddlers Age 2 3 4 5 6 7 Years Old Boys Girls",EditExclude listing,$6.03Auction,$0.00100% Free shipping,1,$6.03,12,"Nov 26, 2023"
14,", preview full size imageCar Toys for 1 2 3 Year Old Boy Educational Toddler Toys Age 1-2 - Push and GoCar Toys for 1 2 3 Year Old Boy Educational Toddler Toys Age 1-2 - Push and Go",EditExclude listing,$14.86Fixed price,$0.00100% Free shipping,2,$29.72,–,"Nov 26, 2023"
15,", preview full size imageBaby Toys 12-18 Months Musical Train Kids Toys For 1 2 3 4+ Year Old Boys GirlsBaby Toys 12-18 Months Musical Train Kids Toys For 1 2 3 4+ Year Old Boys Girls",EditSell SimilarExclude listing,$34.15Fixed price,$0.00100% Free shipping,1,$34.15,–,"Nov 26, 2023"
16,", preview full size imageALASOU Animal Car Toys for 1 2 3 Year Old Boy|Toddler Toys Age 1-2 |1st BirthdayALASOU Animal Car Toys for 1 2 3 Year Old Boy|Toddler Toys Age 1-2 |1st Birthday",EditExclude listing,$23.27Fixed price,$0.00100% Free shipping,2,$46.54,–,"Nov 26, 2023"
17,", preview full size imageUnicorn Gifts for Girls Age 6-8 Gifts for 1 One 2 3 4 5 6 7 8 9 Year Old Girl...Unicorn Gifts for Girls Age 6-8 Gifts for 1 One 2 3 4 5 6 7 8 9 Year Old Girl...",EditExclude listing,$23.55Fixed price,$0.00100% Free shipping,1,$23.55,–,"Nov 26, 2023"
18,", preview full size image 2 in 1 Baby Toys for 1 Year Old Boy Girl Birthday Gift, Piano Keyboard Mat &  2 in 1 Baby Toys for 1 Year Old Boy Girl Birthday Gift, Piano Keyboard Mat & ",EditExclude listing,$39.84Fixed price,$0.00100% Free shipping,1,$39.84,–,"Nov 26, 2023"
19,", preview full size imageBaby Toys for 1 Year Old Boys & Girls, 2 in 1 Musical Toys, Toddler Piano & DrumBaby Toys for 1 Year Old Boys & Girls, 2 in 1 Musical Toys, Toddler Piano & Drum",EditExclude listing,$32.99Fixed price,$0.00100% Free shipping,1,$32.99,–,"Nov 26, 2023"
20,", preview full size imageConstruction Toddler Truck Toys for 3 4 5 6 Year Old Boys - 5-In-1 Friction PoweConstruction Toddler Truck Toys for 3 4 5 6 Year Old Boys - 5-In-1 Friction Powe",EditSell SimilarExclude listing,$36.99Fixed price,$0.00100% Free shipping,1,$36.99,–,"Nov 26, 2023"
21,", preview full size imageBuilding Toys for Age 5 6 7 8+ Year Old Boys Gift, 6 in 1 Engineering Toys, STEMBuilding Toys for Age 5 6 7 8+ Year Old Boys Gift, 6 in 1 Engineering Toys, STEM",EditSell SimilarExclude listing,$45.85Fixed price,$0.00100% Free shipping,1,$45.85,–,"Nov 26, 2023"
22,", preview full size imageTalking Flash Cards Learning Toys for Boys Girls Toddlers Toy 1 2 3 4 5 Year OldTalking Flash Cards Learning Toys for Boys Girls Toddlers Toy 1 2 3 4 5 Year Old",EditExclude listing,$14.09Fixed price,$0.00100% Free shipping,1,$14.09,–,"Nov 26, 2023"
23,", preview full size image2-in-1 Musical Mat Toys for 1 2 3 4 5 Year Old, Piano Keyboard & Drum Set... 2-in-1 Musical Mat Toys for 1 2 3 4 5 Year Old, Piano Keyboard & Drum Set... ",EditExclude listing,$33.05Fixed price,$0.00100% Free shipping,2,$66.09,–,"Nov 25, 2023"
24,", preview full size imageToddlers Toys for 1 2 3 Years Old Kids Pound A Ball Toys Hammer + Stacking CupsToddlers Toys for 1 2 3 Years Old Kids Pound A Ball Toys Hammer + Stacking Cups",EditSell SimilarExclude listing,$16.96Fixed price,$13.450% Free shipping,1,$16.96,–,"Nov 25, 2023"
25,", preview full size imageBaby toys 6 to 12 months, Montessori toys for 1 year old, Silicone Pull String Baby toys 6 to 12 months, Montessori toys for 1 year old, Silicone Pull String ",EditExclude listing,$44.79Fixed price,$0.00100% Free shipping,1,$44.79,–,"Nov 25, 2023"
26,", preview full size imageToys Xylophone 12 Months + Music Hammer Baby Kids 1, 2, 3 Year Old NEWToys Xylophone 12 Months + Music Hammer Baby Kids 1, 2, 3 Year Old NEW",EditExclude listing,$13.80Fixed price,$3.5075% Free shipping,4,$55.19,–,"Nov 25, 2023"
27,", preview full size image9 PCS Soft Car Toys for 1 Year Old Boy and Girl, First One Year Old Boy Birthday9 PCS Soft Car Toys for 1 Year Old Boy and Girl, First One Year Old Boy Birthday",EditExclude listing,$37.32Fixed price,$0.00100% Free shipping,2,$74.64,–,"Nov 25, 2023"
28,", preview full size imageEducational Learning Toys for Kids Toddlers Age 1 2 3 4 5 6 Years Old Boys GirlsEducational Learning Toys for Kids Toddlers Age 1 2 3 4 5 6 Years Old Boys Girls",EditExclude listing,$13.99Fixed price,$0.00100% Free shipping,1,$13.99,–,"Nov 25, 2023"
29,", preview full size imageToddler Toys Car for Boys: Kids Toys for 1 2 3 4 Year Old Boys | Boy Toys 5 i...Toddler Toys Car for Boys: Kids Toys for 1 2 3 4 Year Old Boys | Boy Toys 5 i...",EditExclude listing,$31.99Fixed price,$0.00100% Free shipping,1,$31.99,–,"Nov 25, 2023"
30,", preview full size imageTEMI Construction Toddler Truck Toys for 3 4 5 6 Year Old Boys - 5-in-1 FrictionTEMI Construction Toddler Truck Toys for 3 4 5 6 Year Old Boys - 5-in-1 Friction",EditExclude listing,$29.37Fixed price,$0.00100% Free shipping,1,$29.37,–,"Nov 25, 2023"
31,", preview full size imageTalking Flash Cards Learning Toys for Boys Girls Toddlers Toy 1 2 3 4 5 Year OldTalking Flash Cards Learning Toys for Boys Girls Toddlers Toy 1 2 3 4 5 Year Old",EditExclude listing,$8.60Fixed price,$0.00100% Free shipping,17,$146.20,–,"Nov 25, 2023"
32,", preview full size imageBopicokok Toys for 1-2 Year Old Girls&Boys Toddler Toys,Magnetic Drawing Board, Bopicokok Toys for 1-2 Year Old Girls&Boys Toddler Toys,Magnetic Drawing Board, ",EditSell SimilarExclude listing,$37.04Fixed price,$0.00100% Free shipping,1,$37.04,–,"Nov 25, 2023"
33,", preview full size imageToys for 1 2 3 Year Old Girl Gifts,10IN LCD Writing Tablet for Kids,Toddler ToysToys for 1 2 3 Year Old Girl Gifts,10IN LCD Writing Tablet for Kids,Toddler Toys",EditExclude listing,$24.53Fixed price,$0.00100% Free shipping,1,$24.53,–,"Nov 25, 2023"
34,", preview full size imageBaby Toys 6-12-18 Months, Montessori Toys for 1 Year Old Boy Birthday Baby Toys 6-12-18 Months, Montessori Toys for 1 Year Old Boy Birthday ",EditExclude listing,$15.58Fixed price,$0.00100% Free shipping,1,$15.58,–,"Nov 25, 2023"
35,", preview full size imageSuction Cup Spinner Toys for 1 Year Old Boy, Spinning top Baby Toys 12-18 MonthsSuction Cup Spinner Toys for 1 Year Old Boy, Spinning top Baby Toys 12-18 Months",EditExclude listing,$11.27Fixed price,$0.00100% Free shipping,1,$11.27,–,"Nov 25, 2023"
36,", preview full size imageSEPHIX Bath Toys for Toddlers 1-3 Year Old Boys Gifts, Swim Turtle Water... SEPHIX Bath Toys for Toddlers 1-3 Year Old Boys Gifts, Swim Turtle Water... ",EditSell SimilarExclude listing,$13.02Fixed price,$0.00100% Free shipping,5,$65.08,–,"Nov 25, 2023"
37,", preview full size imageMontessori Toys Busy Book Gift for 1 2 3 4 Year Old Toddler Sensory Board TravelMontessori Toys Busy Book Gift for 1 2 3 4 Year Old Toddler Sensory Board Travel",EditExclude listing,$15.75Fixed price,$0.00100% Free shipping,1,$15.75,–,"Nov 24, 2023"
38,", preview full size imageConstruction Toddler Truck-Toys for 3 4 5 6 Year Old Boys 5-In-1 Friction New-USConstruction Toddler Truck-Toys for 3 4 5 6 Year Old Boys 5-In-1 Friction New-US",EditSell SimilarExclude listing,$36.81Fixed price,$0.00100% Free shipping,13,$478.50,–,"Nov 24, 2023"
39,", preview full size imageKecristv 7-in-1 Baby Sensory Montessori Toys for 1 Year Old, Toddler Toys for 1Kecristv 7-in-1 Baby Sensory Montessori Toys for 1 Year Old, Toddler Toys for 1",EditExclude listing,$28.68Fixed price,$0.00100% Free shipping,1,$28.68,–,"Nov 24, 2023"
40,", preview full size imageEducational Toy For 6 Months And 1 2 3 Year Old Boy Girl Toddler Musical Mat NEWEducational Toy For 6 Months And 1 2 3 Year Old Boy Girl Toddler Musical Mat NEW",EditSell SimilarExclude listing,$30.65Fixed price,$0.00100% Free shipping,1,$30.65,–,"Nov 24, 2023"
41,", preview full size imageToys For 1 Year Old Boy Girl Gifts Educational Birthday Toddler Baby Driving NewToys For 1 Year Old Boy Girl Gifts Educational Birthday Toddler Baby Driving New",EditExclude listing,$16.41Fixed price,$0.00100% Free shipping,2,$32.82,–,"Nov 24, 2023"
42,", preview full size imageAnimal Car Baby Toys for 1 2 3 Year Old Boy|First Birthday Gifts for Toddler ToyAnimal Car Baby Toys for 1 2 3 Year Old Boy|First Birthday Gifts for Toddler Toy",EditExclude listing,$30.46Fixed price,$0.00100% Free shipping,1,$30.46,–,"Nov 24, 2023"
43,", preview full size imageWooden Puzzles for Toddlers 1-3 Toys Gifts for 1 2 3 Year Old Boys Girls, 6 PackWooden Puzzles for Toddlers 1-3 Toys Gifts for 1 2 3 Year Old Boys Girls, 6 Pack",EditExclude listing,$27.24Fixed price,$0.00100% Free shipping,2,$54.48,–,"Nov 24, 2023"
44,", preview full size imageToy for 1 2 3 Year Old Boy/Girl, Baby Toy 6 to 12 Months Electric Train Toys forToy for 1 2 3 Year Old Boy/Girl, Baby Toy 6 to 12 Months Electric Train Toys for",EditExclude listing,$16.74Fixed price,$0.00100% Free shipping,1,$16.74,–,"Nov 24, 2023"
45,", preview full size imageToys for 1-10 Year Old GirlsStar Projector for Kids 2-9 Year Old Girl Gifts ToyToys for 1-10 Year Old GirlsStar Projector for Kids 2-9 Year Old Girl Gifts Toy",EditExclude listing,$16.63Fixed price,$0.00100% Free shipping,5,$83.14,–,"Nov 24, 2023"
46,", preview full size imageHOLA Toys for 1 Year Old Boy Gifts - 4 PCS Toy Trucks 2 1 Year Old Toys for B...HOLA Toys for 1 Year Old Boy Gifts - 4 PCS Toy Trucks 2 1 Year Old Toys for B...",EditExclude listing,$25.35Fixed price,$0.00100% Free shipping,3,$76.06,–,"Nov 24, 2023"
47,", preview full size imageZMZS First Birthday Toddler Piano Toys for 1 Year Old Girls, Baby Musical Key...ZMZS First Birthday Toddler Piano Toys for 1 Year Old Girls, Baby Musical Key...",EditExclude listing,$27.99Fixed price,$0.00100% Free shipping,1,$27.99,–,"Nov 24, 2023"
48,", preview full size imageUNIH Baby Toys for 1 Year Old Boy/Girl, Musical Dinosaur Car CrawlingUNIH Baby Toys for 1 Year Old Boy/Girl, Musical Dinosaur Car Crawling",EditExclude listing,$7.90Fixed price,$5.900% Free shipping,1,$7.90,–,"Nov 23, 2023"
49,", preview full size imageTalking Flash Cards Learning Toys for Boys Girls Toddlers Toy 1 2 3 4 5 Year OldTalking Flash Cards Learning Toys for Boys Girls Toddlers Toy 1 2 3 4 5 Year Old",EditSell SimilarExclude listing,$12.30Fixed price,$0.00100% Free shipping,30,$368.89,–,"Nov 23, 2023"
0,", preview full size imageEducational Tablet Toys For 1-7 Year Olds Toddlers Baby Kids Learning & PlayingEducational Tablet Toys For 1-7 Year Olds Toddlers Baby Kids Learning & Playing",EditSell SimilarExclude listing,$16.54Fixed price,$0.00100% Free shipping,46,$760.94,–,"Nov 23, 2023"
1,", preview full size imageFat Brain Toys Original Dimpl Sensory Baby 1 Year Old Toy BPA-Free Silicone New.Fat Brain Toys Original Dimpl Sensory Baby 1 Year Old Toy BPA-Free Silicone New.",EditExclude listing,$13.50Fixed price,$9.000% Free shipping,1,$13.50,–,"Nov 22, 2023"
2,", preview full size imageNew Educational Toys For 1-6 Year Olds Interactive Kids Learning Tablet ToddlersNew Educational Toys For 1-6 Year Olds Interactive Kids Learning Tablet Toddlers",EditSell SimilarExclude listing,$18.99Fixed price,$0.00100% Free shipping,1,$18.99,–,"Nov 22, 2023"
3,", preview full size imageHmiL-U Montessori Busy Board - Educational Toy for 1 2 3 4 5 Year Old - SensoryHmiL-U Montessori Busy Board - Educational Toy for 1 2 3 4 5 Year Old - Sensory",EditExclude listing,$17.98Fixed price,$0.00100% Free shipping,2,$35.96,–,"Nov 22, 2023"
