,Listing,Actions,Avg Sold Price,Avg Shipping,Total Sold,Item_Sale,Bids,Date Last Sold
46,", preview full size imageNew Educational Toy For 6 Months And 1 2 3 Year Old Boy Girl Toddler Musical MatNew Educational Toy For 6 Months And 1 2 3 Year Old Boy Girl Toddler Musical Mat",EditExclude listing,$11.35Fixed price,$0.00100% Free shipping,15,$170.20,–,"May 3, 2023"
47,", preview full size imageToys for 1 2 3 Year Old Boy Girl Funny House Educational Infant Baby Toys 6 t...Toys for 1 2 3 Year Old Boy Girl Funny House Educational Infant Baby Toys 6 t...",EditExclude listing,$28.67Fixed price,$4.990% Free shipping,1,$28.67,–,"May 3, 2023"
48,", preview full size imageEducational Toy For 6 Months & 1 2 3 Year Old Boy Girl Toddler Learn Musical MatEducational Toy For 6 Months & 1 2 3 Year Old Boy Girl Toddler Learn Musical Mat",EditExclude listing,$12.49Fixed price,$0.00100% Free shipping,1,$12.49,–,"May 2, 2023"
49,", preview full size imageTalking Flash Cards Learning Toys 112 Sheets for Toddlers 1 2 3 4 5 6 Year OldTalking Flash Cards Learning Toys 112 Sheets for Toddlers 1 2 3 4 5 6 Year Old",EditExclude listing,$15.80Fixed price,$0.00100% Free shipping,1,$15.80,–,"May 1, 2023"
0,", preview full size imageToy Cars for 1 Year Old Boy Gifts Ambulance Toddler Toy with Lights and Siren...Toy Cars for 1 Year Old Boy Gifts Ambulance Toddler Toy with Lights and Siren...",EditExclude listing,$31.88Fixed price,$0.00100% Free shipping,1,$31.88,–,"May 1, 2023"
1,", preview full size imageMontessori Toys for 1 to 3-Year-Old Boys Girls Toddlers, Wooden Sorting & StackiMontessori Toys for 1 to 3-Year-Old Boys Girls Toddlers, Wooden Sorting & Stacki",EditExclude listing,$20.86Fixed price,$0.00100% Free shipping,1,$20.86,–,"May 1, 2023"
2,", preview full size imageTOP BRIGHT Bead Maze Toys for 1 Year Old Boy Gifts - Educational Bead Maze forTOP BRIGHT Bead Maze Toys for 1 Year Old Boy Gifts - Educational Bead Maze for",EditExclude listing,$19.71Fixed price,$0.00100% Free shipping,3,$59.13,–,"May 1, 2023"
3,", preview full size imageBaby Montessori Toys for 1 Year Old Boy, Toddler Travel Sensory Babies EducationBaby Montessori Toys for 1 Year Old Boy, Toddler Travel Sensory Babies Education",EditExclude listing,$9.74Fixed price,$0.00100% Free shipping,2,$19.48,–,"May 1, 2023"
4,", preview full size imageMontessori Toys for 1 2 3 Year Old Boys Girls Toddlers Wooden Sorting StackingMontessori Toys for 1 2 3 Year Old Boys Girls Toddlers Wooden Sorting Stacking",EditExclude listing,$15.20Fixed price,$0.00100% Free shipping,5,$76.02,–,"May 1, 2023"
5,", preview full size imageToddler Busy Board Montessori Toys for 1 2 3 Year Old|Autism Sensory Toys forToddler Busy Board Montessori Toys for 1 2 3 Year Old|Autism Sensory Toys for",EditExclude listing,$17.79Fixed price,$0.00100% Free shipping,3,$53.37,–,"May 1, 2023"
6,", preview full size imageKids Toys for 3 2 1 Year Old Girls Toys Age 3 2 1,Magna Doodle Drawing Board GifKids Toys for 3 2 1 Year Old Girls Toys Age 3 2 1,Magna Doodle Drawing Board Gif",EditSell SimilarExclude listing,$26.40Fixed price,$0.00100% Free shipping,8,$211.18,–,"Apr 30, 2023"
7,", preview full size imageFishin' Bath Toys For Kids Girls Boys Toddlers Bathing  1 Year Old Age Magnetic Fishin' Bath Toys For Kids Girls Boys Toddlers Bathing  1 Year Old Age Magnetic ",EditSell SimilarExclude listing,$13.77Fixed price,$0.00100% Free shipping,180,"$2,478.32",–,"Apr 29, 2023"
8,", preview full size imageTEMI Construction Truck Toys for 3 4 5 6 Year Old Boys, 5-In-1 Friction Power ToTEMI Construction Truck Toys for 3 4 5 6 Year Old Boys, 5-In-1 Friction Power To",EditExclude listing,$30.84Fixed price,$27.8150% Free shipping,2,$61.68,–,"Apr 27, 2023"
9,", preview full size imageMontessori Toys for 1 Year Old Boy Girl Wooden Activity Cube Toys for 1 Year OldMontessori Toys for 1 Year Old Boy Girl Wooden Activity Cube Toys for 1 Year Old",EditExclude listing,$23.43Fixed price,$0.00100% Free shipping,2,$46.86,–,"Apr 27, 2023"
10,", preview full size imageBaby Cell Phone Toys for 1 Year Old Girl Gifts, Baby Phone Toy, Kids PhoneBaby Cell Phone Toys for 1 Year Old Girl Gifts, Baby Phone Toy, Kids Phone",EditExclude listing,$18.99Fixed price,$0.00100% Free shipping,1,$18.99,–,"Apr 27, 2023"
11,", preview full size imageToys for 1-10 Year Old GirlsStar Projector for Kids 2-9 Year Old Girl Gifts T...Toys for 1-10 Year Old GirlsStar Projector for Kids 2-9 Year Old Girl Gifts T...",EditExclude listing,$17.25Fixed price,$0.00100% Free shipping,4,$68.99,–,"Apr 27, 2023"
12,", preview full size imageToy Truck Car Carrier Kids Toys for 1 2 3 4 5 Year Old Boys GirlsToy Truck Car Carrier Kids Toys for 1 2 3 4 5 Year Old Boys Girls",EditExclude listing,$32.00Fixed price,$0.00100% Free shipping,1,$32.00,–,"Apr 27, 2023"
13,", preview full size imageMontessori Toys For 1 2 3 Year Old Toddlers, Wooden Shape Sorter Toy Carrot HaMontessori Toys For 1 2 3 Year Old Toddlers, Wooden Shape Sorter Toy Carrot Ha",EditSell SimilarExclude listing,$11.99Fixed price,$0.00100% Free shipping,1,$11.99,–,"Apr 27, 2023"
14,", preview full size imageLOL-FUN Baby Balance Bike Toys for 1 Year Old Boy and Girl Gifts One Year Old BiLOL-FUN Baby Balance Bike Toys for 1 Year Old Boy and Girl Gifts One Year Old Bi",EditExclude listing,$42.15Fixed price,$0.00100% Free shipping,1,$42.15,–,"Apr 27, 2023"
15,", preview full size image7 in 1 Toddler Montessori Toys for 1 Year Old Baby Boy Girl, Wooden Educational7 in 1 Toddler Montessori Toys for 1 Year Old Baby Boy Girl, Wooden Educational",EditExclude listing,$7.00Fixed price,$11.450% Free shipping,1,$7.00,–,"Apr 27, 2023"
16,", preview full size imageWooden Baby Push Walkers for 1 Year Old Boys Girls, Push and Pull Learning Ac...Wooden Baby Push Walkers for 1 Year Old Boys Girls, Push and Pull Learning Ac...",EditExclude listing,$55.78Fixed price,$0.00100% Free shipping,1,$55.78,–,"Apr 25, 2023"
17,", preview full size imageKids Rolling Pony Toddler Ride-on Horse Activity Toy Gift for 1 2 3 Year OldsKids Rolling Pony Toddler Ride-on Horse Activity Toy Gift for 1 2 3 Year Olds",EditExclude listing,$36.69Fixed price,$0.00100% Free shipping,1,$36.69,–,"Apr 24, 2023"
18,", preview full size imageTOP BRIGHT Wooden Activity Cube Toys for 1 2 Year Old Boy Gril One Year Old FtnTOP BRIGHT Wooden Activity Cube Toys for 1 2 Year Old Boy Gril One Year Old Ftn",EditExclude listing,$25.37Fixed price,$0.00100% Free shipping,1,$25.37,–,"Apr 24, 2023"
19,", preview full size imageBaby Dinosaur Toy Cars for 1 2 3 Year Old Toddlers, 3-Pack Press and Go Dino TruBaby Dinosaur Toy Cars for 1 2 3 Year Old Toddlers, 3-Pack Press and Go Dino Tru",EditExclude listing,$26.28Fixed price,$0.00100% Free shipping,1,$26.28,–,"Apr 24, 2023"
20,", preview full size imageLUXIIL Busy Board Montessori Toys for Toddlers 3in1 Gifts for 1 2 3 4 5 Year OldLUXIIL Busy Board Montessori Toys for Toddlers 3in1 Gifts for 1 2 3 4 5 Year Old",EditExclude listing,$11.99Fixed price,$8.090% Free shipping,1,$11.99,–,"Apr 23, 2023"
21,", preview full size imageEducational Toys Baby Tablet For 1-6 year old Boy Girl Learning & Playing Gift.Educational Toys Baby Tablet For 1-6 year old Boy Girl Learning & Playing Gift.",EditExclude listing,$6.99Fixed price,$2.990% Free shipping,1,$6.99,–,"Apr 23, 2023"
22,", preview full size imageEducational Toy Baby Tablet For 1-6 year old Boy Girl Learning Creative Toy GiftEducational Toy Baby Tablet For 1-6 year old Boy Girl Learning Creative Toy Gift",EditExclude listing,$7.15Fixed price,$1.9967% Free shipping,3,$21.44,–,"Apr 22, 2023"
23,", preview full size imageToys Kids Torch Projector Boys Girls Educational 1 2 3 to 6 7 Year Old Xmas GiftToys Kids Torch Projector Boys Girls Educational 1 2 3 to 6 7 Year Old Xmas Gift",EditSell SimilarExclude listing,$8.48Fixed price,$0.00100% Free shipping,12,$101.74,–,"Apr 21, 2023"
24,", preview full size imageBaby Toys Scooter Ride on Toys for Toddlers 1 Year Old Boy & Girl Craft GiftBaby Toys Scooter Ride on Toys for Toddlers 1 Year Old Boy & Girl Craft Gift",EditExclude listing,$33.41Fixed price,$0.00100% Free shipping,1,$33.41,–,"Apr 21, 2023"
25,", preview full size imageFishin' Bath Toys For Kids Girls Boys Toddlers Bathing  1 Year Old Age Magnetic Fishin' Bath Toys For Kids Girls Boys Toddlers Bathing  1 Year Old Age Magnetic ",EditSell SimilarExclude listing,$10.54Fixed price,$0.00100% Free shipping,4,$42.16,–,"Apr 21, 2023"
26,", preview full size imageToys for 1 Year Old Girl Gifts Baby Toys 12-18 Months, 15 Functions Baby Girl Toys for 1 Year Old Girl Gifts Baby Toys 12-18 Months, 15 Functions Baby Girl ",EditExclude listing,$27.51Fixed price,$0.00100% Free shipping,1,$27.51,–,"Apr 20, 2023"
27,", preview full size imageEarly Education Toys For 1-8 Year Olds Toddlers Baby Kids Learning & PlayingEarly Education Toys For 1-8 Year Olds Toddlers Baby Kids Learning & Playing",EditSell SimilarExclude listing,$15.75Fixed price,$0.00100% Free shipping,5,$78.77,–,"Apr 19, 2023"
28,", preview full size imageMold Free Infant Bath Toys for 1 Year Old - 6Pcs No Hole Ocean Sea Animal BathtuMold Free Infant Bath Toys for 1 Year Old - 6Pcs No Hole Ocean Sea Animal Bathtu",EditExclude listing,$18.61Fixed price,$0.00100% Free shipping,1,$18.61,–,"Apr 19, 2023"
29,", preview full size imageToys For 1 Year Old Boy Girl Gifts Educational Birthday Toddler Baby Driving NewToys For 1 Year Old Boy Girl Gifts Educational Birthday Toddler Baby Driving New",EditExclude listing,$17.24Fixed price,$0.00100% Free shipping,1,$17.24,–,"Apr 19, 2023"
30,", preview full size imageMontessori Toys for 1 2 3 Year Old Boys Girls Gifts Wooden Sorting and StackingMontessori Toys for 1 2 3 Year Old Boys Girls Gifts Wooden Sorting and Stacking",EditExclude listing,$8.00Fixed price,$6.650% Free shipping,1,$8.00,–,"Apr 19, 2023"
31,", preview full size imageResumplan 8 in 1 Activity Cube for 1 2 3 4 Year Old Boys and Girls, Wooden ToysResumplan 8 in 1 Activity Cube for 1 2 3 4 Year Old Boys and Girls, Wooden Toys",EditExclude listing,$31.40Fixed price,$0.00100% Free shipping,2,$62.79,–,"Apr 18, 2023"
32,", preview full size imageTOP BRIGHT Bead Maze Toys for 1 Year Old Boy Gifts - Educational Bead Maze fo...TOP BRIGHT Bead Maze Toys for 1 Year Old Boy Gifts - Educational Bead Maze fo...",EditExclude listing,$21.16Fixed price,$0.00100% Free shipping,3,$63.48,–,"Apr 18, 2023"
33,", preview full size imageTalking Flash Cards Learning Toys for Boys Girls Toddlers Toy 1 2 3 4 5 Year OldTalking Flash Cards Learning Toys for Boys Girls Toddlers Toy 1 2 3 4 5 Year Old",EditExclude listing,$15.99Fixed price,$0.00100% Free shipping,2,$31.98,–,"Apr 17, 2023"
34,", preview full size imageMontessori Toys for 1 2 3 4 5 Year Old Boys Girls Toddlers Preschool LearningMontessori Toys for 1 2 3 4 5 Year Old Boys Girls Toddlers Preschool Learning",EditExclude listing,$39.55Fixed price,$0.00100% Free shipping,2,$79.10,–,"Apr 17, 2023"
35,", preview full size imageVTech, Count and Chomp Dino, Dinosaur Learning Toy for 1 Year OldsVTech, Count and Chomp Dino, Dinosaur Learning Toy for 1 Year Olds",EditExclude listing,$18.90Fixed price,$17.050% Free shipping,1,$18.90,–,"Apr 17, 2023"
36,", preview full size imageToys for 1 Year Old Boy Girl Early Education Hammer Toys for Toddlers Child KidsToys for 1 Year Old Boy Girl Early Education Hammer Toys for Toddlers Child Kids",EditExclude listing,$15.63Fixed price,$0.00100% Free shipping,1,$15.63,–,"Apr 17, 2023"
37,", preview full size imageEducational Learning Toys for 6 Months 1 2 3 Years Old Baby Toddlers Boys GirlsEducational Learning Toys for 6 Months 1 2 3 Years Old Baby Toddlers Boys Girls",EditExclude listing,$7.89Fixed price,$0.00100% Free shipping,44,$347.36,–,"Apr 17, 2023"
38,", preview full size imageMontessori & Toddler Toys for 1 Year Old Boy/Girl, Baby Toys 12-18 Months with NMontessori & Toddler Toys for 1 Year Old Boy/Girl, Baby Toys 12-18 Months with N",EditExclude listing,$11.64Fixed price,$0.00100% Free shipping,2,$23.28,–,"Apr 17, 2023"
39,", preview full size imageEinstein Box - 1 Year Old Boys & Girls Learning & Educational Toys & Games NEW!Einstein Box - 1 Year Old Boys & Girls Learning & Educational Toys & Games NEW!",EditSell SimilarExclude listing,$25.98Fixed price,$0.00100% Free shipping,3,$77.94,–,"Apr 16, 2023"
40,", preview full size imageBaby Balance Bike Toys for 1 Year Old Gifts Boys Girls 10-24 Months Kids Toy TodBaby Balance Bike Toys for 1 Year Old Gifts Boys Girls 10-24 Months Kids Toy Tod",EditExclude listing,$35.00Fixed price,$0.00100% Free shipping,1,$35.00,–,"Apr 16, 2023"
41,", preview full size image7 Pack Bath Toys For Kids Girls Boys Toddlers Toddler 1 Year Old Age Magnetic7 Pack Bath Toys For Kids Girls Boys Toddlers Toddler 1 Year Old Age Magnetic",EditSell SimilarExclude listing,$10.16Fixed price,$0.00100% Free shipping,4,$40.65,–,"Apr 16, 2023"
42,", preview full size imageBaby Toys for 1 Year Old Boys & Girls 2 in 1 Musical Toys Toddler PianoBaby Toys for 1 Year Old Boys & Girls 2 in 1 Musical Toys Toddler Piano",EditSell SimilarExclude listing,$34.32Fixed price,$0.00100% Free shipping,1,$34.32,–,"Apr 16, 2023"
43,", preview full size imageBaby Musical Toys 3 in 1 Piano Keyboard Xylophone Drum Set Gift for 1 Year Old Baby Musical Toys 3 in 1 Piano Keyboard Xylophone Drum Set Gift for 1 Year Old ",EditExclude listing,$66.85Fixed price,$0.00100% Free shipping,2,$133.70,–,"Apr 16, 2023"
44,", preview full size imageToddler Toys Car for Boys: Kids Toys for 1 2 3 4 5 Year Old Boys Girls | Boy 7 1Toddler Toys Car for Boys: Kids Toys for 1 2 3 4 5 Year Old Boys Girls | Boy 7 1",EditExclude listing,$36.61Fixed price,$0.00100% Free shipping,1,$36.61,–,"Apr 16, 2023"
45,", preview full size imageEducational Toy Baby Tablet For 1-6 year old Boy Girl Learning Creative Toy GiftEducational Toy Baby Tablet For 1-6 year old Boy Girl Learning Creative Toy Gift",EditSell SimilarExclude listing,$5.70Fixed price,$1.9983% Free shipping,15,$85.48,–,"Apr 16, 2023"
46,", preview full size imageBobike Baby Balance Bike Toys for 1 Year Old Girl Gifts 10-24 Months Pink Bobike Baby Balance Bike Toys for 1 Year Old Girl Gifts 10-24 Months Pink ",EditExclude listing,$21.50Auction,$7.150% Free shipping,1,$21.50,4,"Apr 15, 2023"
47,", preview full size imageChicco Toddler Toy Car for 1 2 3 4 5 Year Old ~ English/Spanish Happy HolidayChicco Toddler Toy Car for 1 2 3 4 5 Year Old ~ English/Spanish Happy Holiday",EditExclude listing,$10.00Fixed price,$12.500% Free shipping,1,$10.00,–,"Apr 15, 2023"
48,", preview full size imageTalkin' Sport Baby Ball with Music Sound FX Toy for 6 7 8 9 10 Months 1 year oldTalkin' Sport Baby Ball with Music Sound FX Toy for 6 7 8 9 10 Months 1 year old",EditExclude listing,$10.00Fixed price,$6.750% Free shipping,1,$10.00,–,"Apr 15, 2023"
49,", preview full size imageTOP BRIGHT Montessori Toys for 1 Year Old Boy Girl Wooden Activity Cube Toys ...TOP BRIGHT Montessori Toys for 1 Year Old Boy Girl Wooden Activity Cube Toys ...",EditExclude listing,$25.01Fixed price,$0.00100% Free shipping,1,$25.01,–,"Apr 14, 2023"
0,", preview full size imageEducational Learning Musical Toy for Baby Toddler Kid 1 2 3 4 Year Old Boy GirlsEducational Learning Musical Toy for Baby Toddler Kid 1 2 3 4 Year Old Boy Girls",EditSell SimilarExclude listing,$15.43Fixed price,$3.0098% Free shipping,48,$740.78,–,"Apr 14, 2023"
1,", preview full size imageWooden Baby Activity Cube for 1 2 Year Old Kids, 5 in 1 Multipurpose ABC-123Wooden Baby Activity Cube for 1 2 Year Old Kids, 5 in 1 Multipurpose ABC-123",EditExclude listing,$56.88Fixed price,$0.00100% Free shipping,1,$56.88,–,"Apr 14, 2023"
2,", preview full size imageBaby Activity Toy Developing Musical Boy Girl Toddler 6 9 12 Month 2 1 Year OldBaby Activity Toy Developing Musical Boy Girl Toddler 6 9 12 Month 2 1 Year Old",EditSell SimilarExclude listing,$23.32Fixed price,$0.00100% Free shipping,3,$69.97,–,"Apr 14, 2023"
3,", preview full size imageLearning Toys for 1+ Year Old, Baby Toy 12-18 Months, Wooden Sorting & StackingLearning Toys for 1+ Year Old, Baby Toy 12-18 Months, Wooden Sorting & Stacking",EditExclude listing,$23.56Fixed price,$0.00100% Free shipping,1,$23.56,–,"Apr 14, 2023"
4,", preview full size imageBaby Toys 6 to 12 Months, Sensory & Montessori Toys for 1 Year Old, Octopus PullBaby Toys 6 to 12 Months, Sensory & Montessori Toys for 1 Year Old, Octopus Pull",EditExclude listing,$14.75Fixed price,$0.00100% Free shipping,1,$14.75,–,"Apr 14, 2023"
5,", preview full size image1-2 Year Old Girls Toddler Toys Magnetic Drawing Board Education 1-2 Year Old Girls Toddler Toys Magnetic Drawing Board Education ",EditExclude listing,$9.99Fixed price,$8.990% Free shipping,1,$9.99,–,"Apr 13, 2023"
6,", preview full size imageGirls First Birthday Gift Age 1 Toddler Toy for 2 Year Old Baby Present MusicGirls First Birthday Gift Age 1 Toddler Toy for 2 Year Old Baby Present Music",EditSell SimilarExclude listing,$30.48Fixed price,$11.260% Free shipping,3,$91.45,–,"Apr 12, 2023"
7,", preview full size imageEducational Toys For 6 Month 1 2 3 year Old Toddler Time And Learn SmartwatchEducational Toys For 6 Month 1 2 3 year Old Toddler Time And Learn Smartwatch",EditExclude listing,$4.00Fixed price,$3.990% Free shipping,1,$4.00,–,"Apr 12, 2023"
8,", preview full size imageDevelopmental Toys For 1 Year Olds Kids Boy Girl Cute Pyppy Baby Rattle Toy BlueDevelopmental Toys For 1 Year Olds Kids Boy Girl Cute Pyppy Baby Rattle Toy Blue",EditSell SimilarExclude listing,$21.76Fixed price,$23.4478% Free shipping,9,$195.82,–,"Apr 11, 2023"
9,", preview full size imagePound a Ball Toy for Toddlers + 6 Stacking Cups for 1 Year Old Boy & Girl DeveloPound a Ball Toy for Toddlers + 6 Stacking Cups for 1 Year Old Boy & Girl Develo",EditExclude listing,$33.40Fixed price,$0.00100% Free shipping,2,$66.80,–,"Apr 11, 2023"
10,", preview full size imageTOP BRIGHT Activity Cube Toys for 1 Year Old Girl, Toddlers Wooden 7 in 1 CubeTOP BRIGHT Activity Cube Toys for 1 Year Old Girl, Toddlers Wooden 7 in 1 Cube",EditExclude listing,$33.75Fixed price,$0.00100% Free shipping,1,$33.75,–,"Apr 11, 2023"
11,", preview full size imageWater Toys Fun for 1 2 3 4 5 6 7 8 9 Years Old Boys and Girls Kids Outdoor PartyWater Toys Fun for 1 2 3 4 5 6 7 8 9 Years Old Boys and Girls Kids Outdoor Party",EditSell SimilarExclude listing,$31.84Fixed price,$0.00100% Free shipping,5,$159.19,–,"Apr 11, 2023"
12,", preview full size imageKids Building Toys STEM Toys for 5-Year-Old Boys 100Pcs 8-In-1Kids Building Toys STEM Toys for 5-Year-Old Boys 100Pcs 8-In-1",EditExclude listing,$32.99Fixed price,$0.00100% Free shipping,1,$32.99,–,"Apr 10, 2023"
13,", preview full size imageEinstein Box for 1 Year Old Boys/Girls Unisex Educational Learning Activity ToyEinstein Box for 1 Year Old Boys/Girls Unisex Educational Learning Activity Toy",EditExclude listing,$21.00Fixed price,$7.740% Free shipping,1,$21.00,–,"Apr 10, 2023"
14,", preview full size imageSEREED Baby Balance Bike for 1 Year Old Boys Girls 12-24 Month ToddlerSEREED Baby Balance Bike for 1 Year Old Boys Girls 12-24 Month Toddler",EditExclude listing,$29.95Fixed price,$12.270% Free shipping,1,$29.95,–,"Apr 10, 2023"
15,", preview full size imageBalance Bike for 1 Year Old Girl Gifts Pre-School First Bike and 1St Birthday GiBalance Bike for 1 Year Old Girl Gifts Pre-School First Bike and 1St Birthday Gi",EditSell SimilarExclude listing,$49.32Fixed price,$0.00100% Free shipping,3,$147.97,–,"Apr 10, 2023"
16,", preview full size imageToddler Toys for 1 2 Year Old Girl Boy Baby Toys for 12 24 Months Wooden ActivitToddler Toys for 1 2 Year Old Girl Boy Baby Toys for 12 24 Months Wooden Activit",EditExclude listing,$59.77Fixed price,$0.00100% Free shipping,1,$59.77,–,"Apr 10, 2023"
17,", preview full size imageLearning Educational TOYS FOR KIDS GIRLS Toddlers Gift For 1 2 3 4 Years OldLearning Educational TOYS FOR KIDS GIRLS Toddlers Gift For 1 2 3 4 Years Old",EditExclude listing,$11.99Fixed price,$0.00100% Free shipping,216,"$2,589.21",–,"Apr 10, 2023"
18,", preview full size imageBaby Balance Bike Toys for 1 Year Old Boy and Girl Gifts One Year Old Birthday, Baby Balance Bike Toys for 1 Year Old Boy and Girl Gifts One Year Old Birthday, ",EditExclude listing,$53.99Fixed price,$0.00100% Free shipping,4,$215.96,–,"Apr 10, 2023"
19,", preview full size imageWooden Activity Cube Toys for 1 2 Year Old Boy GrilOne Year Old First BirthdayWooden Activity Cube Toys for 1 2 Year Old Boy GrilOne Year Old First Birthday",EditExclude listing,$23.30Fixed price,$0.00100% Free shipping,1,$23.30,–,"Apr 10, 2023"
20,", preview full size imageHOOLYUK Montessori Busy Board Toy for 1 2 3 Year Old Boy, Wooden Controller SensHOOLYUK Montessori Busy Board Toy for 1 2 3 Year Old Boy, Wooden Controller Sens",EditExclude listing,$15.00Fixed price,$0.00100% Free shipping,1,$15.00,–,"Apr 9, 2023"
21,", preview full size imageObject Permanence Box, Montessori Toys for 1 Year Old, Baby Toys 6-12 MonthsObject Permanence Box, Montessori Toys for 1 Year Old, Baby Toys 6-12 Months",EditSell SimilarExclude listing,$29.95Fixed price,$0.00100% Free shipping,1,$29.95,–,"Apr 9, 2023"
22,", preview full size image Educational Learning Cube Toy for Kids Toddlers Age 1 2 3 4 Year Old Boy Girl Educational Learning Cube Toy for Kids Toddlers Age 1 2 3 4 Year Old Boy Girl",EditSell SimilarExclude listing,$19.85Fixed price,$0.00100% Free shipping,2,$39.69,–,"Apr 9, 2023"
23,", preview full size imageToys for 1-2 Year Old Girls,Magnetic Drawing Board Toddler Toys for Girls Boys,EToys for 1-2 Year Old Girls,Magnetic Drawing Board Toddler Toys for Girls Boys,E",EditExclude listing,$19.19Fixed price,$0.00100% Free shipping,6,$115.14,–,"Apr 8, 2023"
24,", preview full size imageCartoon Car Toys for 1 2 3 Year Old Boy|ToddlerCartoon Car Toys for 1 2 3 Year Old Boy|Toddler",EditExclude listing,$19.99Fixed price,$0.00100% Free shipping,1,$19.99,–,"Apr 8, 2023"
25,", preview full size imageBusy Board Montessori Toy for 1 2 3 4 Year Old Toddlers Educational ActivityBusy Board Montessori Toy for 1 2 3 4 Year Old Toddlers Educational Activity",EditExclude listing,$32.23Fixed price,$0.00100% Free shipping,1,$32.23,–,"Apr 8, 2023"
26,", preview full size imageKids Dinosaur Toys for 3 4 5 6 7 8 Year Old Boys Gifts 5 in 1 Dinosaur Buildi...Kids Dinosaur Toys for 3 4 5 6 7 8 Year Old Boys Gifts 5 in 1 Dinosaur Buildi...",EditExclude listing,$9.99Fixed price,$3.650% Free shipping,1,$9.99,–,"Apr 8, 2023"
27,", preview full size imageBaby Piano Toys for Toddlers 1 2 3 Frist Birthday Gifts for One Year Old GirlsBaby Piano Toys for Toddlers 1 2 3 Frist Birthday Gifts for One Year Old Girls",EditExclude listing,$28.35Fixed price,$0.00100% Free shipping,5,$141.75,–,"Apr 8, 2023"
28,", preview full size imageDeejoy Cars Toys for 1 2 3 4 Year Old Boys - 4 Pack Construction Trucks Push... Deejoy Cars Toys for 1 2 3 4 Year Old Boys - 4 Pack Construction Trucks Push... ",EditExclude listing,$19.95Fixed price,$0.00100% Free shipping,1,$19.95,–,"Apr 8, 2023"
29,", preview full size imageSmasiagon Toddler Boy Toys for 1 2 3 Year Old Boys Magnetic Drawing BoardSmasiagon Toddler Boy Toys for 1 2 3 Year Old Boys Magnetic Drawing Board",EditExclude listing,$36.67Fixed price,$0.00100% Free shipping,2,$73.34,–,"Apr 8, 2023"
30,", preview full size imageToys For 1 10 Year Old Girls Star Projector Kids 2 9 Girl Gifts 3 8 Christmas 4Toys For 1 10 Year Old Girls Star Projector Kids 2 9 Girl Gifts 3 8 Christmas 4",EditExclude listing,$15.99Fixed price,$0.00100% Free shipping,1,$15.99,–,"Apr 7, 2023"
31,", preview full size imageBobike Baby Balance Bike Toys for 1 Year Old Girl Gifts 10-24 Months Pink Bobike Baby Balance Bike Toys for 1 Year Old Girl Gifts 10-24 Months Pink ",EditExclude listing,$38.99Fixed price,$0.00100% Free shipping,1,$38.99,–,"Apr 7, 2023"
32,", preview full size imageMontessori Coin Box, Montessori Toys for 1 Year olds, Baby Toys 12 MonthsMontessori Coin Box, Montessori Toys for 1 Year olds, Baby Toys 12 Months",EditExclude listing,$14.95Fixed price,$0.00100% Free shipping,1,$14.95,–,"Apr 6, 2023"
33,", preview full size imageBusy Board Montessori Toys for Toddlers Sensory Toys Gifts for 1 2 3 4 Year OldBusy Board Montessori Toys for Toddlers Sensory Toys Gifts for 1 2 3 4 Year Old",EditExclude listing,$6.35Fixed price,$5.700% Free shipping,1,$6.35,–,"Apr 6, 2023"
34,", preview full size imageXylophone for toddlers 1-3 years old - ToyXylophone for toddlers 1-3 years old - Toy",EditExclude listing,$7.00Fixed price,$3.000% Free shipping,1,$7.00,–,"Apr 6, 2023"
35,", preview full size image1 Year Old Girl Gifts - Baby Toys for 1 Year Old Girl Boy Piano Drum Set Toddler1 Year Old Girl Gifts - Baby Toys for 1 Year Old Girl Boy Piano Drum Set Toddler",EditExclude listing,$54.99Fixed price,$0.00100% Free shipping,1,$54.99,–,"Apr 6, 2023"
36,", preview full size imageBaby Toys 6 to 12 Months - Soft Car Toys for 1 Year Old Boy Girl with PlaymatBaby Toys 6 to 12 Months - Soft Car Toys for 1 Year Old Boy Girl with Playmat",EditExclude listing,$19.88Fixed price,$0.00100% Free shipping,1,$19.88,–,"Apr 5, 2023"
37,", preview full size image1 Year Old Girl Gifts - Baby Toys for 1 Year Old Girl Boy Musical Piano Drum ...1 Year Old Girl Gifts - Baby Toys for 1 Year Old Girl Boy Musical Piano Drum ...",EditExclude listing,$52.49Fixed price,$0.00100% Free shipping,1,$52.49,–,"Apr 5, 2023"
38,", preview full size imageMontessori Toys for Babies 1 2 3 Years Old Building Blocks ToysMontessori Toys for Babies 1 2 3 Years Old Building Blocks Toys",EditExclude listing,$39.98Fixed price,$0.00100% Free shipping,3,$119.94,–,"Apr 4, 2023"
