,Listing,Actions,Avg Sold Price,Avg Shipping,Total Sold,Item_Sale,Bids,Date Last Sold
0,", preview full size imageTEMI 5-in-1 Construction Truck for 3-9 Year Old Boys & Girls Friction Power NewTEMI 5-in-1 Construction Truck for 3-9 Year Old Boys & Girls Friction Power New",EditSell SimilarExclude listing,$31.81Fixed price,$0.00100% Free shipping,3,$95.43,–,"Mar 20, 2024"
1,", preview full size imageToddler Busy Board Montessori Toys for 1 2 3 4 Year Old Girls/Boys Sensory BoardToddler Busy Board Montessori Toys for 1 2 3 4 Year Old Girls/Boys Sensory Board",EditSell SimilarExclude listing,$19.46Fixed price,$0.00100% Free shipping,15,$291.83,–,"Mar 20, 2024"
2,", preview full size imageEducational Toys for 6 Month 1 2 3 Year Old Boy Girl Toddler Learning SmartwatchEducational Toys for 6 Month 1 2 3 Year Old Boy Girl Toddler Learning Smartwatch",EditSell SimilarExclude listing,$11.36Fixed price,$0.00100% Free shipping,61,$693.21,–,"Mar 20, 2024"
3,", preview full size imageBaby Balance Bike Toys for 1 Year Old Boy and Girl Gifts One Year OldBaby Balance Bike Toys for 1 Year Old Boy and Girl Gifts One Year Old",EditSell SimilarExclude listing,$45.50Fixed price,$0.00100% Free shipping,1,$45.50,–,"Mar 20, 2024"
4,", preview full size imageToddler Montessori Toys for 1 2 3 4 Year Old Boys Girls, Travel Sensory Fine ...Toddler Montessori Toys for 1 2 3 4 Year Old Boys Girls, Travel Sensory Fine ...",EditSell SimilarExclude listing,$8.97Fixed price,$0.00100% Free shipping,4,$35.86,–,"Mar 20, 2024"
5,", preview full size imageToddlers Montessori Toys for 1 2 3 Year Old, Wood Educational Shape Sorting T...Toddlers Montessori Toys for 1 2 3 Year Old, Wood Educational Shape Sorting T...",EditSell SimilarExclude listing,$14.70Fixed price,$0.00100% Free shipping,10,$147.04,–,"Mar 20, 2024"
6,", preview full size imageToddler Fire Toys for 3 4 5 6 Years Old Boys Girls - 5 in 1 Carrier Truck #TOYToddler Fire Toys for 3 4 5 6 Years Old Boys Girls - 5 in 1 Carrier Truck #TOY",EditSell SimilarExclude listing,$24.00Fixed price,$0.00100% Free shipping,1,$24.00,–,"Mar 20, 2024"
7,", preview full size imageToys for 1 2 3 Year Old Girl, 5-In-1 Carrier Truck for Toddler Girl, Friction PoToys for 1 2 3 Year Old Girl, 5-In-1 Carrier Truck for Toddler Girl, Friction Po",EditSell SimilarExclude listing,$25.99Fixed price,$0.00100% Free shipping,3,$77.98,–,"Mar 20, 2024"
8,", preview full size imageBaby Toy Cars For 1 Year Old Boy Gifts Press And Go Car Educational Toys For kidBaby Toy Cars For 1 Year Old Boy Gifts Press And Go Car Educational Toys For kid",EditSell SimilarExclude listing,$7.23Fixed price,$0.00100% Free shipping,6,$43.35,–,"Mar 20, 2024"
9,", preview full size imageTalking Flash Cards Learning Toys for Boys Girls Toddlers Toy 1 2 3 4 5 Year OldTalking Flash Cards Learning Toys for Boys Girls Toddlers Toy 1 2 3 4 5 Year Old",EditSell SimilarExclude listing,$12.64Fixed price,$31.6699% Free shipping,114,"$1,440.69",–,"Mar 20, 2024"
10,", preview full size imageGear Lighting Electric Bus 1 2 3 Year Old Boy & Girl/LED Colorful Music Baby ToyGear Lighting Electric Bus 1 2 3 Year Old Boy & Girl/LED Colorful Music Baby Toy",EditSell SimilarExclude listing,$15.51Fixed price,$0.00100% Free shipping,33,$511.70,–,"Mar 20, 2024"
11,", preview full size imageToddler Montessori Toys Busy Board for Boys Girls 1 2 3 4 One Year Old- BabyToddler Montessori Toys Busy Board for Boys Girls 1 2 3 4 One Year Old- Baby",EditSell SimilarExclude listing,$9.90Fixed price,$0.00100% Free shipping,7,$69.33,–,"Mar 19, 2024"
12,", preview full size image1 Year Old Girl Gifts, Piano Mat Baby Toys for 1 Year Old Girl, 2 in 11 Year Old Girl Gifts, Piano Mat Baby Toys for 1 Year Old Girl, 2 in 1",EditSell SimilarExclude listing,$19.99Fixed price,$0.00100% Free shipping,2,$39.98,–,"Mar 19, 2024"
13,", preview full size imageBusy Board Montessori Toy for 1 2 3 4 Years Old, Educational Activity SensoryBusy Board Montessori Toy for 1 2 3 4 Years Old, Educational Activity Sensory",EditSell SimilarExclude listing,$19.99Fixed price,$0.00100% Free shipping,1,$19.99,–,"Mar 19, 2024"
14,", preview full size imageToys for 1 Year Old Boy Gifts, 2 in 1 Musical Piano&Drum Mat, Baby Toys for 6 toToys for 1 Year Old Boy Gifts, 2 in 1 Musical Piano&Drum Mat, Baby Toys for 6 to",EditSell SimilarExclude listing,$18.50Fixed price,$0.00100% Free shipping,1,$18.50,–,"Mar 19, 2024"
15,", preview full size imageBusy Board Montessori Toddler Toys for 1 2 3 4 Year Old Boy Girl Gift, Baby E...Busy Board Montessori Toddler Toys for 1 2 3 4 Year Old Boy Girl Gift, Baby E...",EditSell SimilarExclude listing,$14.80Fixed price,$0.00100% Free shipping,5,$74.01,–,"Mar 19, 2024"
16,", preview full size imageEducational Toys Baby Tablet For 1-6 year old Boy Girl Learning & Playing GiftEducational Toys Baby Tablet For 1-6 year old Boy Girl Learning & Playing Gift",EditSell SimilarExclude listing,$8.71Fixed price,$7.9860% Free shipping,7,$60.96,–,"Mar 19, 2024"
17,", preview full size imageSoft Car Toys for 1 Year Old Boy Girl - Baby Toys 6 to 12 Months 12-18 Months PuSoft Car Toys for 1 Year Old Boy Girl - Baby Toys 6 to 12 Months 12-18 Months Pu",EditSell SimilarExclude listing,$15.99Fixed price,$0.00100% Free shipping,1,$15.99,–,"Mar 18, 2024"
18,", preview full size imageToys For 1 10 Year Old Girls Star Projector Kids 2 9 Girl Gifts 3 8 Christmas 4Toys For 1 10 Year Old Girls Star Projector Kids 2 9 Girl Gifts 3 8 Christmas 4",EditSell SimilarExclude listing,$24.81Fixed price,$0.00100% Free shipping,1,$24.81,–,"Mar 18, 2024"
19,", preview full size imageBaby Montessori Toys for 1 Year Old, Infant Newborn Boys Girls Birthday Gifts...Baby Montessori Toys for 1 Year Old, Infant Newborn Boys Girls Birthday Gifts...",EditSell SimilarExclude listing,$10.32Fixed price,$0.00100% Free shipping,8,$82.57,–,"Mar 18, 2024"
20,", preview full size imageBaby Montessori Toys for 1 2 3 Year Old Boys Girls, Toddler Toys Age 1-2, WoodenBaby Montessori Toys for 1 2 3 Year Old Boys Girls, Toddler Toys Age 1-2, Wooden",EditSell SimilarExclude listing,$9.61Fixed price,$0.00100% Free shipping,2,$19.22,–,"Mar 18, 2024"
21,", preview full size imageLearning Toys for Toddler 1, 2, 3 Years Old, 5 in 1 Wooden Activity Cube GirlLearning Toys for Toddler 1, 2, 3 Years Old, 5 in 1 Wooden Activity Cube Girl",EditSell SimilarExclude listing,$14.71Fixed price,$0.00100% Free shipping,1,$14.71,–,"Mar 18, 2024"
22,", preview full size imageToy for 1 2 3 Year Old Boy/Girl, Baby Toy 6 to 12 Months Electric Train Toys forToy for 1 2 3 Year Old Boy/Girl, Baby Toy 6 to 12 Months Electric Train Toys for",EditSell SimilarExclude listing,$16.14Fixed price,$0.00100% Free shipping,102,"$1,645.89",–,"Mar 18, 2024"
23,", preview full size imageToddler Montessori Toys Busy Board for Boys Girls 1 2 3 4 One Year Old- BabyToddler Montessori Toys Busy Board for Boys Girls 1 2 3 4 One Year Old- Baby",EditSell SimilarExclude listing,$14.96Fixed price,$0.00100% Free shipping,5,$74.79,–,"Mar 18, 2024"
24,", preview full size imageMusical Toys For Toddlers Girls Boys Baby Kids 1 2 3 Year Olds Storybook RhymesMusical Toys For Toddlers Girls Boys Baby Kids 1 2 3 Year Olds Storybook Rhymes",EditSell SimilarExclude listing,$28.17Fixed price,$0.00100% Free shipping,6,$169.00,–,"Mar 18, 2024"
25,", preview full size imageGear Lighting Electric Train 1 2 3 Year Old Boy/Girl, Baby Toy 6 to 12 MonthsGear Lighting Electric Train 1 2 3 Year Old Boy/Girl, Baby Toy 6 to 12 Months",EditSell SimilarExclude listing,$13.66Fixed price,$17.58100% Free shipping,281,"$3,838.78",–,"Mar 18, 2024"
26,", preview full size imageBaby Montessori Toys for 1 2 3 Year Old Boys Girls, Toddler Toys Age 1-2, WoodenBaby Montessori Toys for 1 2 3 Year Old Boys Girls, Toddler Toys Age 1-2, Wooden",EditSell SimilarExclude listing,$13.50Fixed price,$0.00100% Free shipping,11,$148.49,–,"Mar 18, 2024"
27,", preview full size imageLovery The Realist Play Kit Months 19, 20, 21 (toddler, Montessori, 1 year old)Lovery The Realist Play Kit Months 19, 20, 21 (toddler, Montessori, 1 year old)",EditSell SimilarExclude listing,$51.00Auction,$8.680% Free shipping,1,$51.00,18,"Mar 18, 2024"
28,", preview full size imageBath Toys For Kids Boys Girls 1 2 3 Year Old Toddlers Baby Age Toddler AnimalsBath Toys For Kids Boys Girls 1 2 3 Year Old Toddlers Baby Age Toddler Animals",EditSell SimilarExclude listing,$17.70Fixed price,$0.00100% Free shipping,12,$212.39,–,"Mar 17, 2024"
29,", preview full size imageToddler Toys for Girls Boys Age 1 2 3 4 Year Old Gift Drawing Board-USAToddler Toys for Girls Boys Age 1 2 3 4 Year Old Gift Drawing Board-USA",EditSell SimilarExclude listing,$13.96Fixed price,$0.00100% Free shipping,2,$27.92,–,"Mar 17, 2024"
30,", preview full size imageToys for 1 2 3 Year Old Boy, Baby Toys 6 to 12 Months Electric Train Toys forToys for 1 2 3 Year Old Boy, Baby Toys 6 to 12 Months Electric Train Toys for",EditSell SimilarExclude listing,$15.59Fixed price,$0.00100% Free shipping,20,$311.85,–,"Mar 17, 2024"
31,", preview full size imageBaby Toy Cars for 1 2 3 Year Old Boy with Play Mat Storage Bag, Push and Go C...Baby Toy Cars for 1 2 3 Year Old Boy with Play Mat Storage Bag, Push and Go C...",EditSell SimilarExclude listing,$19.68Fixed price,$0.00100% Free shipping,1,$19.68,–,"Mar 17, 2024"
32,", preview full size imageToys for 1-10 Year Old Girls,Star Projector for Kids 2-9 Year Old Girl Gifts ...Toys for 1-10 Year Old Girls,Star Projector for Kids 2-9 Year Old Girl Gifts ...",EditSell SimilarExclude listing,$15.84Fixed price,$0.00100% Free shipping,16,$253.45,–,"Mar 17, 2024"
33,", preview full size imageTalking Flash Cards Learning Toys for Boys Girls Toddlers Toy 1 2 3 4 5 Year OldTalking Flash Cards Learning Toys for Boys Girls Toddlers Toy 1 2 3 4 5 Year Old",EditSell SimilarExclude listing,$12.45Fixed price,$0.00100% Free shipping,7,$87.15,–,"Mar 17, 2024"
34,", preview full size image6 Pack Wooden Jigsaw Puzzles for Toddlers Baby Kids 1 2 3 +Years Old Color Shape6 Pack Wooden Jigsaw Puzzles for Toddlers Baby Kids 1 2 3 +Years Old Color Shape",EditSell SimilarExclude listing,$11.98Fixed price,$0.00100% Free shipping,2,$23.96,–,"Mar 17, 2024"
35,", preview full size imageWooden Puzzles for Toddlers 1-3 Toys Gifts for 1 2 3 Year Old Boys Girls, 4 PackWooden Puzzles for Toddlers 1-3 Toys Gifts for 1 2 3 Year Old Boys Girls, 4 Pack",EditSell SimilarExclude listing,$19.40Fixed price,$0.00100% Free shipping,3,$58.20,–,"Mar 17, 2024"
36,", preview full size imageToys For 1 10 Year Old Girls Star Projector Kids 2 9 Girl Gifts 3 8 Christmas 4Toys For 1 10 Year Old Girls Star Projector Kids 2 9 Girl Gifts 3 8 Christmas 4",EditSell SimilarExclude listing,$23.98Fixed price,$0.00100% Free shipping,3,$71.95,–,"Mar 17, 2024"
37,", preview full size imageMusical Toys For Girls Baby Kids Toddlers 1 2 3 Year Old Learning & EducationalMusical Toys For Girls Baby Kids Toddlers 1 2 3 Year Old Learning & Educational",EditSell SimilarExclude listing,$34.04Fixed price,$0.00100% Free shipping,13,$442.48,–,"Mar 17, 2024"
38,", preview full size imageBaby Balance Bike Toys for 1 Year Old Boy Girl Gifts, 10-24 Month Toddler Bal...Baby Balance Bike Toys for 1 Year Old Boy Girl Gifts, 10-24 Month Toddler Bal...",EditSell SimilarExclude listing,$43.91Fixed price,$0.00100% Free shipping,3,$131.74,–,"Mar 17, 2024"
39,", preview full size imageToddler Montessori Toys Busy Board for Boys Girls 1 2 3 4 One Year Old- BabyToddler Montessori Toys Busy Board for Boys Girls 1 2 3 4 One Year Old- Baby",EditSell SimilarExclude listing,$11.29Fixed price,$0.00100% Free shipping,2,$22.57,–,"Mar 16, 2024"
40,", preview full size imageMontessori Toys for 1 2 3 Year Old Boys Girls, Sensory Toys for Toddlers 1-3, WoMontessori Toys for 1 2 3 Year Old Boys Girls, Sensory Toys for Toddlers 1-3, Wo",EditSell SimilarExclude listing,$10.52Fixed price,$0.00100% Free shipping,22,$231.40,–,"Mar 16, 2024"
41,", preview full size image1-2 Years old Boys & Girls Holiday Toddler Toys 6 in 1 Activity Cube Baby1-2 Years old Boys & Girls Holiday Toddler Toys 6 in 1 Activity Cube Baby",EditSell SimilarExclude listing,$7.30Fixed price,$0.00100% Free shipping,1,$7.30,–,"Mar 16, 2024"
42,", preview full size imageMagnetic Fishing Rod & 6 Bath Fishes Toy For Toddlers Kids Age 1 2 3 4 Years OldMagnetic Fishing Rod & 6 Bath Fishes Toy For Toddlers Kids Age 1 2 3 4 Years Old",EditSell SimilarExclude listing,$10.83Fixed price,$0.00100% Free shipping,2,$21.66,–,"Mar 16, 2024"
43,Item ID 404687489427,EditExclude listing,$11.99Fixed price,$0.00100% Free shipping,3,$35.97,–,"Mar 16, 2024"
44,", preview full size image 8 in 1 STEM Building Toys for 4 5 6 7 8 9 10 11 12 Year Old Kids Boys Girls,  8 in 1 STEM Building Toys for 4 5 6 7 8 9 10 11 12 Year Old Kids Boys Girls, ",EditSell SimilarExclude listing,$30.44Fixed price,$0.00100% Free shipping,3,$91.33,–,"Mar 16, 2024"
45,", preview full size imageSuction Cup Spinner Toy for Baby - 12 Pcs Window Toys for Toddlers 1-3 Year OldSuction Cup Spinner Toy for Baby - 12 Pcs Window Toys for Toddlers 1-3 Year Old",EditSell SimilarExclude listing,$19.29Fixed price,$0.00100% Free shipping,3,$57.86,–,"Mar 15, 2024"
46,", preview full size image8 in 1 Montessori Toys for 1+ Year Old Toddlers Whack a Mole Game Wooden Hamm...8 in 1 Montessori Toys for 1+ Year Old Toddlers Whack a Mole Game Wooden Hamm...",EditSell SimilarExclude listing,$15.05Fixed price,$0.00100% Free shipping,1,$15.05,–,"Mar 15, 2024"
47,", preview full size image25-IN-1 Busy Board: Montessori Toy For 1-4 Year Old Toddlers Develop Fine Motor25-IN-1 Busy Board: Montessori Toy For 1-4 Year Old Toddlers Develop Fine Motor",EditSell SimilarExclude listing,$16.99Fixed price,$0.00100% Free shipping,2,$33.98,–,"Mar 15, 2024"
48,", preview full size imageMontessori Toys for 1 2 3 Year Old Boys Girls, Sensory Toys for Toddlers 1-3Montessori Toys for 1 2 3 Year Old Boys Girls, Sensory Toys for Toddlers 1-3",EditSell SimilarExclude listing,$11.82Fixed price,$0.00100% Free shipping,1,$11.82,–,"Mar 15, 2024"
49,", preview full size imageEductional Toys Torch Night Projector Light For 2-10 Year Old Kids Boy Girl GiftEductional Toys Torch Night Projector Light For 2-10 Year Old Kids Boy Girl Gift",EditSell SimilarExclude listing,$10.94Fixed price,$0.00100% Free shipping,2,$21.88,–,"Mar 15, 2024"
0,", preview full size imageEducational Toys for Kids Toddlers Girls Boys 1 2 3 Year Olds Learning MusicalEducational Toys for Kids Toddlers Girls Boys 1 2 3 Year Olds Learning Musical",EditSell SimilarExclude listing,$27.50Fixed price,$0.00100% Free shipping,3,$82.50,–,"Mar 14, 2024"
1,", preview full size imageLearning Toys for Toddler 1+ Years Old 5 in 1 Wooden Activity Cube with SortingLearning Toys for Toddler 1+ Years Old 5 in 1 Wooden Activity Cube with Sorting",EditSell SimilarExclude listing,$15.37Fixed price,$0.00100% Free shipping,1,$15.37,–,"Mar 14, 2024"
2,", preview full size imageBaby Toys 1 Year Old Boy Girl Gifts 12-18 M Hammer with Music & Light BirthdayBaby Toys 1 Year Old Boy Girl Gifts 12-18 M Hammer with Music & Light Birthday",EditSell SimilarExclude listing,$25.04Fixed price,$0.00100% Free shipping,1,$25.04,–,"Mar 14, 2024"
3,", preview full size imageEducational Learning Toys for 6 Months 1 2 3 Years Old Baby Toddlers Boys GirlsEducational Learning Toys for 6 Months 1 2 3 Years Old Baby Toddlers Boys Girls",EditSell SimilarExclude listing,$14.08Fixed price,$0.00100% Free shipping,39,$549.03,–,"Mar 14, 2024"
4,", preview full size imageWooden Montessori Toys Busy Board for 1 2 3 4 Year Old, Baby Toddler Sensory ...Wooden Montessori Toys Busy Board for 1 2 3 4 Year Old, Baby Toddler Sensory ...",EditSell SimilarExclude listing,$31.98Fixed price,$0.00100% Free shipping,1,$31.98,–,"Mar 14, 2024"
5,", preview full size imageConstruction Toddler Truck Toys for 3 4 5 6 Year Old Boys - 5-In-1 Friction PoweConstruction Toddler Truck Toys for 3 4 5 6 Year Old Boys - 5-In-1 Friction Powe",EditSell SimilarExclude listing,$39.99Fixed price,$0.00100% Free shipping,2,$79.98,–,"Mar 14, 2024"
6,", preview full size imageMontessori Toys 1 2 3 Year Old Girl Boys Sensory Toddler Wooden Sorting StackingMontessori Toys 1 2 3 Year Old Girl Boys Sensory Toddler Wooden Sorting Stacking",EditSell SimilarExclude listing,$10.98Fixed price,$0.00100% Free shipping,6,$65.89,–,"Mar 14, 2024"
7,", preview full size imageEducational Learning Musical Toy for Baby Toddler Kid 1 2 3 4 Year Old Boy GirlsEducational Learning Musical Toy for Baby Toddler Kid 1 2 3 4 Year Old Boy Girls",EditSell SimilarExclude listing,$14.58Fixed price,$0.00100% Free shipping,28,$408.27,–,"Mar 14, 2024"
8,", preview full size imageToddler Fire Toys for 3 4 5 6 Years Old Boys Girls - 5 in 1 Carrier Truck TranspToddler Fire Toys for 3 4 5 6 Years Old Boys Girls - 5 in 1 Carrier Truck Transp",EditSell SimilarExclude listing,$25.00Fixed price,$0.00100% Free shipping,1,$25.00,–,"Mar 13, 2024"
9,", preview full size image7 in 1 Educational Learning Toys for Kids Toddlers Age 2 3 4 5 6 7 8 Years Old7 in 1 Educational Learning Toys for Kids Toddlers Age 2 3 4 5 6 7 8 Years Old",EditSell SimilarExclude listing,$21.99Fixed price,$0.00100% Free shipping,7,$153.93,–,"Mar 13, 2024"
10,", preview full size imageToys for 1 Year Old Girl Gifts 2 in 1 Musical Piano&Drum Mat Baby Infant PinkToys for 1 Year Old Girl Gifts 2 in 1 Musical Piano&Drum Mat Baby Infant Pink",EditSell SimilarExclude listing,$18.75Fixed price,$0.00100% Free shipping,24,$450.00,–,"Mar 13, 2024"
11,", preview full size imageBaby Toy Phone for 1, 2 Year Old with Light, Music| My First Smartphone ToyBaby Toy Phone for 1, 2 Year Old with Light, Music| My First Smartphone Toy",EditSell SimilarExclude listing,$12.95Fixed price,$0.00100% Free shipping,1,$12.95,–,"Mar 13, 2024"
12,", preview full size imageFishing Bath Toys For Kids Girl Boy-Toddlers Bathing 1 2 3 Year Old Age MagneticFishing Bath Toys For Kids Girl Boy-Toddlers Bathing 1 2 3 Year Old Age Magnetic",EditSell SimilarExclude listing,$9.99Fixed price,$0.00100% Free shipping,2,$19.98,–,"Mar 13, 2024"
13,", preview full size imageToddler Toys LED Busy Board,Montessori Toy for 1-3 Year Old, Kids Sensory Boa...Toddler Toys LED Busy Board,Montessori Toy for 1-3 Year Old, Kids Sensory Boa...",EditSell SimilarExclude listing,$9.99Fixed price,$5.950% Free shipping,1,$9.99,–,"Mar 13, 2024"
14,", preview full size imageToddler Montessori Toys Busy Board for Boys Girls 1 2 3 4 One Year Old- BabyToddler Montessori Toys Busy Board for Boys Girls 1 2 3 4 One Year Old- Baby",EditSell SimilarExclude listing,$14.41Fixed price,$0.00100% Free shipping,26,$374.56,–,"Mar 13, 2024"
15,", preview full size imageToddler Toys for Girls Boys Age 1 2 3 4 Year Old Gift,Magnetic Drawing BoardToddler Toys for Girls Boys Age 1 2 3 4 Year Old Gift,Magnetic Drawing Board",EditSell SimilarExclude listing,$13.76Fixed price,$0.00100% Free shipping,3,$41.27,–,"Mar 13, 2024"
16,", preview full size imageToys for 1 Year Old Girl Gifts 2 in 1 Musical Piano&Drum Mat Baby Infant PinkToys for 1 Year Old Girl Gifts 2 in 1 Musical Piano&Drum Mat Baby Infant Pink",EditSell SimilarExclude listing,$14.01Fixed price,$0.00100% Free shipping,1,$14.01,–,"Mar 13, 2024"
17,", preview full size imageMontessori Toys for 1 Year old-Baby Toys 6 to 12 Months Sensory Toys forMontessori Toys for 1 Year old-Baby Toys 6 to 12 Months Sensory Toys for",EditSell SimilarExclude listing,$12.27Fixed price,$0.00100% Free shipping,2,$24.54,–,"Mar 12, 2024"
18,", preview full size imageBaby Activity Toy Table -Music Learning Toddler Gift for 1~3 Year Old Boys @B12Baby Activity Toy Table -Music Learning Toddler Gift for 1~3 Year Old Boys @B12",EditSell SimilarExclude listing,$24.30Fixed price,$0.00100% Free shipping,1,$24.30,–,"Mar 12, 2024"
19,", preview full size image Farm Animal Sorting & Stacking Blocks - Montessori Toy for 1-3 Year Old Kids  Farm Animal Sorting & Stacking Blocks - Montessori Toy for 1-3 Year Old Kids ",EditSell SimilarExclude listing,$32.92Fixed price,$0.00100% Free shipping,1,$32.92,–,"Mar 12, 2024"
20,", preview full size imageSoft Car Toys for 1 Year Old Boy Girl - Baby Toys 6 to 12 Months 12-18 Months PuSoft Car Toys for 1 Year Old Boy Girl - Baby Toys 6 to 12 Months 12-18 Months Pu",EditSell SimilarExclude listing,$13.40Fixed price,$0.00100% Free shipping,1,$13.40,–,"Mar 12, 2024"
21,", preview full size imageADFO 5 in 1 Baby Toys 6to12-18 Months, 43PCS Montessori Toys for 1 2 3 Year Old,ADFO 5 in 1 Baby Toys 6to12-18 Months, 43PCS Montessori Toys for 1 2 3 Year Old,",EditSell SimilarExclude listing,$17.68Fixed price,$0.00100% Free shipping,5,$88.42,–,"Mar 12, 2024"
22,", preview full size imageEducational Toys For 6 Months 1 2 3 4 year Old Girl Boy Toddler Learning MusicalEducational Toys For 6 Months 1 2 3 4 year Old Girl Boy Toddler Learning Musical",EditSell SimilarExclude listing,$16.52Fixed price,$0.00100% Free shipping,189,"$3,121.80",–,"Mar 12, 2024"
23,", preview full size image7 in 1 Baby Toys 6 to 12 Months Activity Cube Montessori Toys for 1 2 Year Old B7 in 1 Baby Toys 6 to 12 Months Activity Cube Montessori Toys for 1 2 Year Old B",EditSell SimilarExclude listing,$22.12Fixed price,$0.00100% Free shipping,8,$176.92,–,"Mar 12, 2024"
24,", preview full size imageMontessori Toddler Busy Board, 27 LED Lights Montessori Toys for 1-6 Year Old, WMontessori Toddler Busy Board, 27 LED Lights Montessori Toys for 1-6 Year Old, W",EditSell SimilarExclude listing,$33.99Fixed price,$0.00100% Free shipping,1,$33.99,–,"Mar 11, 2024"
25,", preview full size imageBaby Balance Bike Toys for 1 Year Old Boy and Girl Gifts One Year OldBaby Balance Bike Toys for 1 Year Old Boy and Girl Gifts One Year Old",EditSell SimilarExclude listing,$43.70Fixed price,$0.00100% Free shipping,7,$305.93,–,"Mar 11, 2024"
26,", preview full size imageMagnetic Drawing Doodle Board - Toddler Toys (Pink) - for 1-3 year oldMagnetic Drawing Doodle Board - Toddler Toys (Pink) - for 1-3 year old",EditSell SimilarExclude listing,$14.99Fixed price,$5.800% Free shipping,1,$14.99,–,"Mar 11, 2024"
27,", preview full size imageYGJT 3 in 1 Tricycle for Toddlers Age 2 3 4 Year Old, Folding Kids Bikes with...YGJT 3 in 1 Tricycle for Toddlers Age 2 3 4 Year Old, Folding Kids Bikes with...",EditSell SimilarExclude listing,$87.84Fixed price,$0.00100% Free shipping,1,$87.84,–,"Mar 11, 2024"
28,", preview full size imageToddler Toys Age 1-2-4 Year Old Boy Girl Gifts: 14*40 14*14 Inches Music MatToddler Toys Age 1-2-4 Year Old Boy Girl Gifts: 14*40 14*14 Inches Music Mat",EditSell SimilarExclude listing,$29.41Fixed price,$0.00100% Free shipping,10,$294.05,–,"Mar 10, 2024"
29,", preview full size imageToy Piano for Kids Birthday Gifts for 1 2 3 4 Year Old Girls Love&Mini Multi-...Toy Piano for Kids Birthday Gifts for 1 2 3 4 Year Old Girls Love&Mini Multi-...",EditSell SimilarExclude listing,$31.30Fixed price,$0.00100% Free shipping,4,$125.19,–,"Mar 10, 2024"
30,", preview full size image7 in 1 Baby Toys 6 to 12 Months Activity Cube Montessori Toys for 1 2 Year Old B7 in 1 Baby Toys 6 to 12 Months Activity Cube Montessori Toys for 1 2 Year Old B",EditSell SimilarExclude listing,$16.99Fixed price,$0.00100% Free shipping,1,$16.99,–,"Mar 10, 2024"
31,", preview full size imageMontessori Toys for 1 Year Old, Baby Toy 12-18 Months, Wooden Shape Sorting &...Montessori Toys for 1 Year Old, Baby Toy 12-18 Months, Wooden Shape Sorting &...",EditSell SimilarExclude listing,$19.54Fixed price,$0.00100% Free shipping,7,$136.80,–,"Mar 9, 2024"
32,", preview full size image Wooden Activity Cube, Montessori Toys for 1+ Year Old Boy, Multipurpose  Wooden Activity Cube, Montessori Toys for 1+ Year Old Boy, Multipurpose ",EditSell SimilarExclude listing,$40.16Fixed price,$0.00100% Free shipping,1,$40.16,–,"Mar 9, 2024"
33,", preview full size imageFire Truck Toys for 1 2 3 4 5 6 Years Old Boys Toddler, 5 in 1 Kids Carrier ToyFire Truck Toys for 1 2 3 4 5 6 Years Old Boys Toddler, 5 in 1 Kids Carrier Toy",EditSell SimilarExclude listing,$40.45Fixed price,$0.00100% Free shipping,4,$161.80,–,"Mar 9, 2024"
34,", preview full size imageBig Red Barn Toys for 1 2 3 Years Old Boys Girls, Preschool Montessori Learni...Big Red Barn Toys for 1 2 3 Years Old Boys Girls, Preschool Montessori Learni...",EditSell SimilarExclude listing,$35.05Fixed price,$0.00100% Free shipping,1,$35.05,–,"Mar 9, 2024"
35,", preview full size imageColorful Lighting Baby Balance Bike Toys for 1 Year Old Boy Gifts, 10-36 Month 4Colorful Lighting Baby Balance Bike Toys for 1 Year Old Boy Gifts, 10-36 Month 4",EditSell SimilarExclude listing,$54.99Fixed price,$0.00100% Free shipping,1,$54.99,–,"Mar 9, 2024"
36,", preview full size imageBaby Girl Toys for 1 2 3 Year Old Birthday Gift, Pop Up Princess Tent with St...Baby Girl Toys for 1 2 3 Year Old Birthday Gift, Pop Up Princess Tent with St...",EditSell SimilarExclude listing,$34.98Fixed price,$0.00100% Free shipping,3,$104.94,–,"Mar 9, 2024"
37,", preview full size imageEducational Toys For 1-7 Year Olds Kid Baby Toddler Tablet Toy Learning TabletEducational Toys For 1-7 Year Olds Kid Baby Toddler Tablet Toy Learning Tablet",EditSell SimilarExclude listing,$13.19Fixed price,$0.00100% Free shipping,6,$79.11,–,"Mar 8, 2024"
38,", preview full size imageWooden Activity Cube Toys for 1 2 Year Old Boy Gril,One Year Old First BirthdayWooden Activity Cube Toys for 1 2 Year Old Boy Gril,One Year Old First Birthday",EditSell SimilarExclude listing,$24.62Fixed price,$5.5687% Free shipping,69,"$1,698.64",–,"Mar 8, 2024"
39,", preview full size imageToys for 1-2 Year Old GirlsMagnetic Drawing Board Toddler Toys for Girls BoyToys for 1-2 Year Old GirlsMagnetic Drawing Board Toddler Toys for Girls Boy",EditSell SimilarExclude listing,$18.51Fixed price,$0.00100% Free shipping,11,$203.65,–,"Mar 8, 2024"
